id,title,text,url,top_img,authors,source,publish_date,movies,images,canonical_link,meta_data,original_sentiment,num_words,avg_sentiment_per_word,avg_generated_sentiment_temp0,avg_num_words_gen_temp0,avg_gen_sentiment_per_word_temp0,avg_generated_sentiment_temp0.5,avg_num_words_gen_temp0.5,avg_gen_sentiment_per_word_temp0.5,avg_generated_sentiment_temp1,avg_num_words_gen_temp1,avg_gen_sentiment_per_word_temp1,diff_sentiment_temp0,diff_sentiment_temp0.5,diff_sentiment_temp1,,,,,,,,
Real_69-Webpage,U.S. attorney sees no rush to arraign Rahami in federal court,"Under the Radar Blog Archives Select Date… July, 2017 June, 2017 May, 2017 April, 2017 March, 2017 February, 2017 January, 2017 December, 2016 November, 2016 October, 2016 September, 2016 August, 2016

Ahmad Khan Rahami is taken into custody after a shootout with police Monday in Linden, N.J. | Nicolaus Czarnecki/Boston Herald via AP U.S. attorney sees no rush to arraign Rahami in federal court

Federal prosecutors are pushing back against a demand by defense lawyers that New York and New Jersey bombing suspect Ahmad Rahami be arraigned immediately on federal charges he is facing.

Late Tuesday, defense attorneys wrote to federal magistrate judge Gabriel Gorenstein asking that Rahami be promptly informed of the charges against him at a court proceeding that would also formally advise him of his right to counsel and his right to remain silent.

However, prosecutors from the office of U.S. Attorney for the Southern District of New York Preet Bharara said in a letter to the magistrate Wednesday that Rahami isn't in federal custody so there is no legal obligation for the federal courts to get involved.

""The defendant in this case, Ahmad Khan Rahami, a/k/a 'Ahmad Rahimi,' has not been arrested on any federal charge. He is not in federal custody. He is in the custody of the State of New Jersey, on state charges, and is subject to a bail package issued by the New Jersey state court,"" federal prosecutors wrote. ""While a writ of habeas corpus ad prosequendum has been lodged with the United States Marshals Service, it has not been executed, and there has been no such federal arrest.""

The writ referred to in the federal prosecutors' letter would require state or local officials to hand over Rahami to federal authorities for prosecution. Rahami is facing five attempted murder charges in a New Jersey court in connection with a shootout Monday morning in which the suspect and two police officers were wounded. Rahami is currently in a Newark hospital. A judge has set $5.2 million bail and an initial county court appearance for Sept. 28.

Defense lawyers contend that Rahami has been ""without the benefit of counsel"" since his arrest, but it's unclear whether he's been advised of his Miranda rights or whether he's made some decision not to meet with an attorney. Lawmakers briefed on the investigation say he has not been cooperating.

While Attorney General Loretta Lynch said Wednesday that Rahami would be taken to Manhattan in the ""near future,"" the letter from prosecutors evinces no urgency to such a move. Prosecutors say Rahami has no rights in the federal system at the moment, including a right to counsel.

The letter indicates that lawyers from the Federal Defenders office in New York have sought appointment in Rahami's case, but prosecutors say that's ""plainly premature"" until he is brought to court. Prosecutors cited a series of terrorism cases where judges ruled defendants were not entitled to court-appointed counsel until they appear in court.

Court records show no immediate action from Gorenstein on the request for Rahami's arraignment or the defense lawyers' request to be appointed as his counsel in the case.

Josh Gerstein is a senior reporter for POLITICO.

Authors:",http://politi.co/2cS8sh4,http://static.politico.com/4e/48/1335ebb54f2bbbda572f510110ac/160920-playbook-ap-700.jpg,Josh Gerstein,http://politi.co,{'$date': 1474471057000},,"https://static.politico.com/dims4/default/cdfa4b0/2147483647/resize/1160x%3E/quality/90/?url=http%3A%2F%2Fstatic.politico.com%2F4e%2F48%2F1335ebb54f2bbbda572f510110ac%2F160920-playbook-ap-700.jpg,data:image/gif;base64,R0lGODlhAQABAAAAACH5BAEKAAEALAAAAAABAAEAAAICTAEAOw==,http://static.politico.com/4e/48/1335ebb54f2bbbda572f510110ac/160920-playbook-ap-700.jpg",http://www.politico.com/blogs/under-the-radar/2016/09/ahmad-rahami-federal-court-charges-228482,"{""description"": ""Prosecutors said that Rahami isn't in federal custody so there is no legal obligation for the federal courts to get involved."", ""og"": {""site_name"": ""POLITICO"", ""description"": ""Prosecutors said that Rahami isn't in federal custody so there is no legal obligation for the federal courts to get involved."", ""title"": ""U.S. attorney sees no rush to arraign Rahami in federal court"", ""url"": ""http://politi.co/2dbzF2m"", ""image"": ""http://static.politico.com/4e/48/1335ebb54f2bbbda572f510110ac/160920-playbook-ap-700.jpg"", ""fb_appid"": 114037015331397, ""type"": ""article""}, ""twitter"": {""site"": ""@politico"", ""card"": ""summary_large_image"", ""creator"": ""@politico""}, ""host"": ""www.politico.com"", ""fb"": {""pages"": 62317591679}, ""build"": ""release/2017-maria 4b1f874 2017-08-24T15:20:21Z"", ""viewport"": ""width=device-width, initial-scale=1""}",-21,597,-0.035175879,-11.2,561,-0.021024747,-9.6,505.8,-0.019913494,-14,600.4,-0.023815315,0.014151132,0.015262386,0.011360564,,,,,,,,
Real_7-Webpage,Donald Trump's rise puts Ted Cruz in a bind,"Story highlights Ted Cruz refused to endorse Trump earlier this year, but is under pressure to change his mind now

Cruz could face a primary challenge in 2018 from a fellow Republican

Washington (CNN) Rep. Trent Franks backed Ted Cruz during the GOP presidential primary, but he now has a message for the Texas Republican: Get in line behind Donald Trump.

""Any person in this party that does not support Trump at this point is increasing the chances of Hillary Clinton becoming president and destroying the Constitution,"" Franks said.

JUST WATCHED Cruz: I won't support those who attack my wife Replay More Videos ... MUST WATCH Cruz: I won't support those who attack my wife 01:51

On the other side, Cruz backers say that the first-term senator should stick to his guns and withhold an endorsement -- or risk angering his own supporters who detest Trump.

""I have five rules for political endorsements,"" said Steve Deace, an Iowa radio talk show host who was an outspoken Cruz backer during the primary. ""And Cruz endorsing Trump violates every single one of them.""

Less than two months until Election Day, Trump has once again put Cruz in a bind. As Trump's poll numbers rise and now is neck-and-neck against Clinton, the GOP nominee's backers are looking for every last ounce of support to showcase that there is momentum and energy behind his campaign. If Trump falls short of Clinton by a narrow margin, Trump's backers are bound to blame holdouts like Cruz for failing to do more to help their party.

Read More",http://cnn.it/2dlbk5X,http://i2.cdn.cnn.com/cnnnext/dam/assets/160127114716-ted-cruz-donald-trump-composite-super-tease.jpg,"Manu Raju,Senior Political Reporter",http://cnn.it,,,"http://i2.cdn.cnn.com/cnnnext/dam/assets/151214104316-trump-cruz-split-1214-exlarge-169.jpg,http://i2.cdn.cnn.com/cnnnext/dam/assets/160720220721-rnc-convention-ted-cruz-booed-00001420-large-169.jpg,http://i2.cdn.cnn.com/cnnnext/dam/assets/160721153511-01-ted-cruz-july-21-2016-large-169.jpg,data:image/gif;base64,R0lGODlhEAAJAJEAAAAAAP///////wAAACH5BAEAAAIALAAAAAAQAAkAAAIKlI+py+0Po5yUFQA7,http://i2.cdn.cnn.com/cnnnext/dam/assets/160127114716-ted-cruz-donald-trump-composite-super-tease.jpg",http://www.cnn.com/2016/09/22/politics/donald-trump-ted-cruz/index.html,"{""description"": ""If Cruz backs Trump now, he'll be accused of political opportunism and anger his core supporters who hailed his controversial speech in Cleveland where he pointedly declined to endorse his party's nominee."", ""pubdate"": ""2016-09-22T22:34:14Z"", ""author"": ""Manu Raju, Senior Political Reporter"", ""og"": {""site_name"": ""CNN"", ""description"": ""If Cruz backs Trump now, he'll be accused of political opportunism and anger his core supporters who hailed his controversial speech in Cleveland where he pointedly declined to endorse his party's nominee."", ""pubdate"": ""2016-09-22T22:34:14Z"", ""title"": ""Donald Trump's rise puts Ted Cruz in a bind"", ""url"": ""http://www.cnn.com/2016/09/22/politics/donald-trump-ted-cruz/index.html"", ""image"": {""width"": 1100, ""identifier"": ""http://i2.cdn.cnn.com/cnnnext/dam/assets/160127114716-ted-cruz-donald-trump-composite-super-tease.jpg"", ""height"": 619}, ""type"": ""article""}, ""section"": ""politics"", ""fb"": {""app_id"": 80401312489, ""pages"": ""5550296508,18793419640""}, ""thumbnail"": ""http://i2.cdn.cnn.com/cnnnext/dam/assets/160127114716-ted-cruz-donald-trump-composite-super-tease.jpg"", ""template-top"": ""politics,bra-2016-elections,art-vid"", ""vr"": {""canonical"": ""http://www.cnn.com/2016/09/22/politics/donald-trump-ted-cruz/index.html""}, ""keywords"": ""politics, Donald Trump's rise puts Ted Cruz in a bind - CNNPolitics"", ""article"": {""author"": ""https://www.facebook.com/mkraju00""}, ""lastmod"": ""2016-09-22T22:34:14Z"", ""twitter"": {""image"": ""http://i2.cdn.cnn.com/cnnnext/dam/assets/160127114716-ted-cruz-donald-trump-composite-super-tease.jpg"", ""description"": ""If Cruz backs Trump now, he'll be accused of political opportunism and anger his core supporters who hailed his controversial speech in Cleveland where he pointedly declined to endorse his party's nominee."", ""card"": ""summary_large_image"", ""title"": ""Donald Trump's rise puts Ted Cruz in a bind""}, ""viewport"": ""width=device-width, initial-scale=1.0, minimum-scale=1.0""}",10,294,0.034013605,4.8,285,0.016665126,8.2,287.4,0.029266024,8.4,284.8,0.029462987,0.017348479,0.004747582,0.004550618,,,,,,,,
Real_70-Webpage,Trump hits Clinton on Islamic State: ‘It is time for change’,"“Crooked Hillary has been fighting ISIS, or whatever she has been doing, for years,” Donald Trump tweets. | AP Photo Trump hits Clinton on Islamic State: ‘It is time for change’

Donald Trump called for a change Tuesday in how the U.S. handles the terror threat of the Islamic State, a shift away from President Barack Obama and Hillary Clinton's policies.

“Crooked Hillary has been fighting ISIS, or whatever she has been doing, for years,” Trump tweeted Tuesday morning. “Now she has new ideas. It is time for change.”

Story Continued Below

Following a series of planted bombs in New York and New Jersey over the weekend and a stabbing in Minnesota, Trump on Monday hammered Clinton on her record amid increasing concerns regarding the terrorist network and the threat of domestic attacks.

The real estate mogul again blamed Clinton and Obama for refusing to utter the words “radical Islamic terrorism” and accused them of emboldening terrorists across the globe.

“Today, Hillary Clinton showed again that she will say anything — and blame anyone — to shift attention away from the weakness she showed as Secretary of State,” he said in a statement Monday, adding that terrorists are “hoping and praying that Hillary Clinton becomes President so that they can continue their savagery and murder.”

Trump vowed to “bring an end to these senseless acts of violence” and condemned the White House, whose spokesman referred to the battle against the Islamic State as a “narrative fight.”

“They are wrong to say that we’re in a fight about ‘narratives,’” Trump said. “These terrorists pose an existential threat to our country, our values, and our way of life.”

Authors:",http://politi.co/2cEsAnL,http://static.politico.com/c9/44/a8bc80254d9d9bc7bbd865df7244/09-donald-trump-9-ap-1160.jpg,"Jack Shafer,Nolan D",http://politi.co,{'$date': 1474360141000},,"https://static.politico.com/dims4/default/8cedd58/2147483647/resize/1160x%3E/quality/90/?url=http%3A%2F%2Fstatic.politico.com%2Fc9%2F44%2Fa8bc80254d9d9bc7bbd865df7244%2F09-donald-trump-9-ap-1160.jpg,data:image/gif;base64,R0lGODlhAQABAAAAACH5BAEKAAEALAAAAAABAAEAAAICTAEAOw==,http://static.politico.com/c9/44/a8bc80254d9d9bc7bbd865df7244/09-donald-trump-9-ap-1160.jpg",http://www.politico.com/story/2016/09/trump-islamic-state-clinton-228397,"{""description"": ""\u201cCrooked Hillary has been fighting ISIS, or whatever she has been doing, for years,\u201d Trump tweets."", ""og"": {""site_name"": ""POLITICO"", ""description"": ""\u201cCrooked Hillary has been fighting ISIS, or whatever she has been doing, for years,\u201d Trump tweets."", ""title"": ""Trump hits Clinton on Islamic State: \u2018It is time for change\u2019"", ""url"": ""http://politi.co/2cOeXlo"", ""image"": ""http://static.politico.com/c9/44/a8bc80254d9d9bc7bbd865df7244/09-donald-trump-9-ap-1160.jpg"", ""fb_appid"": 114037015331397, ""type"": ""article""}, ""twitter"": {""site"": ""@politico"", ""card"": ""summary_large_image"", ""creator"": ""@politico""}, ""host"": ""www.politico.com"", ""fb"": {""pages"": 62317591679}, ""build"": ""release/2017-maria 4b1f874 2017-08-24T15:20:21Z"", ""article"": {""author"": ""https://www.facebook.com/NolanDMcCaskill""}, ""viewport"": ""width=device-width, initial-scale=1""}",-41,328,-0.125,-24.6,309.8,-0.079192158,-23.6,317.4,-0.074270871,-26.2,332.8,-0.078630553,0.045807842,0.050729129,0.046369447,,,,,,,,
Real_71-Webpage,Bridgegate: Port Authority officials planned to make Fort Lee 'traffic jam as bad as possible',"Newark (CNN) Former Port Authority executives and New Jersey Gov. Chris Christie staffers planned to make the traffic from the September 2013 lane closures at the George Washington Bridge ""as bad as possible,"" according to testimony heard in federal court Monday.

David Wildstein, former Port Authority director of Interstate Capital Projects, testified that in June 2013, Bridget Kelly, Christie's former deputy chief of staff, was upset that their office had not secured the endorsement of the Democratic mayor of Fort Lee New Jersey, Mark Sokolich, for Christie's reelection campaign.

Wildstein, who has previously pleaded guilty to one charge of conspiracy to commit fraud on federally funded property and one civil rights violation, told Kelly that shutting down access lanes to the George Washington Bridge to put some political pressure on Sokolich was an option, according to his testimony.

Wildstein is testifying as part of his plea deal. Sokolich testified last week that being a ""Democrat in a Democratic town"" put him in an uncomfortable position vis-a-vis a Christie endorsement, and he eventually declined because he did not want to ""alienate anyone.""

On August 13, 2013, and as CNN has previously reported, Wildstein received an email from Kelly saying: ""Time for some traffic problems in Fort Lee.""

""Got it,"" Wildstein responded.

A phone call with Kelly the same day established the lane closures would go forward, it was revealed in testimony Monday.

""I did not question senior officials in the office of the governor,"" Wildstein said in court when asked if he questioned the decision.

Wildstein became the de facto organizer of the eventual lane closures, and communicated every step of the way with Kelly and his then-boss, former Port Authority deputy executive director, Bill Baroni, according to his testimony.

Wildstein and Kelly discussed and agreed that there would be no advance notice of the closures to Fort Lee officials or the public. They discussed how the Port Authority would respond to any inquiries, and agreed that all calls would be directed to Baroni's office and Baroni would not return the calls, testimony revealed.

This ""radio silence"" policy was discussed with and approved by Baroni, Wildstein said.

Wildstein testified that that lack of advance notice was to ""maximize the impact on Fort Lee."" Wildstein also recalled discussing the timing of the closures with Baroni and Kelly.

Baroni asked when the first day of school in Fort Lee was, and when Wildstein told Baroni it was September 9, Baroni smiled and said, ""Fantastic,"" according to Wildstein's testimony. Kelly agreed on the September 9 date.

Wildstein testified that his initial plan was to shut down all three Fort Lee access lanes, but after discussing the matter with Port Authority engineers who feared this could cause ""sideswipe crashes,"" Wildstein recommended to Baroni and Kelly that they shut down two lanes.

On Friday, September 6, 2013, Wildstein informed several Port Authority staffers of the closures that were scheduled to begin on Monday, September 9.

Bob Durando, Port Authority general manager of the George Washington Bridge expressed concern, telling Wildstein that the closures would cause a ""mess.""

Wildstein told Durando the closures would be going forward, and to prepare accordingly.

""I told him not to say anything to anybody,"" Wildstein testified. Wildstein told Durando to direct any inquiries he gets during the closures to Baroni's office.

Wildstein then informed former Port Authority chief engineer, Peter Zipf, of the closures, and asked Zipf to organize a way to get ""some numbers"" on the traffic patterns.

Wildstein also informed Cedrick Fulton, Port Authority director of Tunnels, Bridges and Terminals. Fulton asked if Port Authority executive director, Patrick Foye, was aware. Wildstein testified that he told Fulton ""yes,"" but that this was a lie.

All of these staffers were under the impression that the closures were part of a traffic study.

On the day the closures began, Wildstein watched the traffic build up on screens inside a Port Authority administration building on the Fort Lee side of the George Washington Bridge.

""I knew the plan that I had set into motion was working,"" Wildstein testified.

A Port Authority lieutenant also drove Wildstein around Fort Lee so Wildstein could see the traffic on the ground.

Wildstein testified that he called Kelly that morning to tell her that traffic was building up, and ""she was pleased.""

Several calls and emails began coming in to Baroni and Wildstein from Fort Lee officials, including the mayor, Sokolich, but their plan of ""radio silence"" was put into effect and no messages were returned.

Last week, Wildstein testified that Baroni's role at the bi-state agency was essentially to be a representative of Christie's administration and that their top priority was to represent Christie's office's interests.

Wildstein said he created a phrase that he and Baroni often used, ""the one constituent rule."" This referred to the fact that Governor Christie's opinion or good favor was the only one that mattered when it came to Port Authority affairs. Wildstein and Baroni used the ""one constituent rule"" as a barometer by which decisions would be made.

Kelly and Baroni face conspiracy and fraud charges in connection with Bridgegate. Their attorneys have previously said they will both testify in their own defenses.",http://cnn.it/2dn8vWp,http://i2.cdn.cnn.com/cnnnext/dam/assets/160719214618-chris-christie-rnc-super-tease.jpg,Dominique Debucquoy-dodley,http://cnn.it,,,"http://i2.cdn.cnn.com/cnnnext/dam/assets/160719214618-chris-christie-rnc-super-tease.jpg,http://i2.cdn.cnn.com/cnnnext/dam/assets/160802200536-chris-christie-august-2-2016-exlarge-169.jpg",http://www.cnn.com/2016/09/26/politics/bridgegate-chris-christie-port-authority-fort-lee/index.html,"{""description"": ""Former Port Authority executives and New Jersey Gov. Chris Christie staffers planned to make the traffic from the September 2013 lane closures at the George Washington Bridge \""as bad as possible,\"" according to testimony heard in federal court Monday."", ""pubdate"": ""2016-09-26T22:41:18Z"", ""author"": ""Dominique Debucquoy-Dodley, CNN"", ""og"": {""site_name"": ""CNN"", ""description"": ""Former Port Authority executives and New Jersey Gov. Chris Christie staffers planned to make the traffic from the September 2013 lane closures at the George Washington Bridge \""as bad as possible,\"" according to testimony heard in federal court Monday."", ""pubdate"": ""2016-09-26T22:41:18Z"", ""title"": ""Bridgegate: Port Authority officials planned to make Fort Lee 'traffic jam as bad as possible'"", ""url"": ""http://www.cnn.com/2016/09/26/politics/bridgegate-chris-christie-port-authority-fort-lee/index.html"", ""image"": {""width"": 1100, ""identifier"": ""http://i2.cdn.cnn.com/cnnnext/dam/assets/160719214618-chris-christie-rnc-super-tease.jpg"", ""height"": 619}, ""type"": ""article""}, ""section"": ""politics"", ""fb"": {""app_id"": 80401312489, ""pages"": ""5550296508,18793419640""}, ""thumbnail"": ""http://i2.cdn.cnn.com/cnnnext/dam/assets/160719214618-chris-christie-rnc-super-tease.jpg"", ""template-top"": ""politics,art-vid"", ""vr"": {""canonical"": ""http://www.cnn.com/2016/09/26/politics/bridgegate-chris-christie-port-authority-fort-lee/index.html""}, ""keywords"": ""politics, Bridgegate: Port Authority officials planned to make Fort Lee 'traffic jam as bad as possible' - CNNPolitics"", ""lastmod"": ""2016-09-26T22:41:18Z"", ""twitter"": {""image"": ""http://i2.cdn.cnn.com/cnnnext/dam/assets/160719214618-chris-christie-rnc-super-tease.jpg"", ""description"": ""Former Port Authority executives and New Jersey Gov. Chris Christie staffers planned to make the traffic from the September 2013 lane closures at the George Washington Bridge \""as bad as possible,\"" according to testimony heard in federal court Monday."", ""card"": ""summary_large_image"", ""title"": ""Bridgegate: Port Authority officials planned to make Fort Lee 'traffic jam as bad as possible'""}, ""viewport"": ""width=device-width, initial-scale=1.0, minimum-scale=1.0""}",9,1009,0.008919722,-17,978.2,-0.017745944,-18.4,1003.4,-0.018301058,-15.2,986.6,-0.015388373,0.026665667,0.02722078,0.024308096,,,,,,,,
Real_72-Webpage,Bono: ‘Trump is potentially the worst idea that ever happened to America’,"Bono: ‘Trump is potentially the worst idea that ever happened to America’

Donald Trump is the antithesis of the United States, according to U2 frontman Bono, who called the Republican presidential nominee “potentially the worst idea that ever happened to America.”

“Look, America is like the best idea the world ever came up with,” Bono, whose real name is Paul David Hewson, told “CBS This Morning” in an interview broadcast Tuesday. “But Donald Trump is potentially the worst idea that ever happened to America. Potentially.”

Story Continued Below

Bono pointed to nations like Ireland and Great Britain as great countries but suggested that America is different because it’s an idea, one that Trump is “trying to hijack.”

“That idea is bound up in justice and equality for all — equality and justice for all, you know,” he continued. “I think he’s hijacked the party. I think he’s trying to hijack the idea of America. And I think it’s bigger than all of us. I think it’s — it’s — this is really dangerous.”

Authors:",http://politi.co/2cN5r3A,http://v.politico.com/images/1155968404/201609/1958/1155968404_5133315275001_5133307402001-vs.jpg?pubId=1155968404,"Jack Shafer,Nolan D",http://politi.co,{'$date': 1474361025000},,"http://v.politico.com/images/1155968404/201609/1958/1155968404_5133315275001_5133307402001-vs.jpg?pubId=1155968404,data:image/gif;base64,R0lGODlhAQABAAAAACH5BAEKAAEALAAAAAABAAEAAAICTAEAOw==",http://www.politico.com/story/2016/09/bono-trump-worst-idea-228398,"{""description"": ""\u201cI think he\u2019s hijacked the party. I think he\u2019s trying to hijack the idea of America,&quot; Bono says."", ""og"": {""site_name"": ""POLITICO"", ""description"": ""\u201cI think he\u2019s hijacked the party. I think he\u2019s trying to hijack the idea of America,&quot; Bono says."", ""title"": ""Bono: \u2018Trump is potentially the worst idea that ever happened to America\u2019"", ""url"": ""http://politi.co/2cAbl4Q"", ""image"": ""http://v.politico.com/images/1155968404/201609/1958/1155968404_5133315275001_5133307402001-vs.jpg?pubId=1155968404"", ""fb_appid"": 114037015331397, ""type"": ""article""}, ""twitter"": {""site"": ""@politico"", ""card"": ""summary_large_image"", ""creator"": ""@politico""}, ""host"": ""www.politico.com"", ""fb"": {""pages"": 62317591679}, ""build"": ""release/2017-maria 4b1f874 2017-08-24T15:20:21Z"", ""article"": {""author"": ""https://www.facebook.com/NolanDMcCaskill""}, ""viewport"": ""width=device-width, initial-scale=1""}",7,219,0.03196347,1.8,216.8,0.009005922,2.4,214,0.011520869,2.4,210.2,0.012208127,0.022957548,0.020442602,0.019755343,,,,,,,,
