id,title,text,url,top_img,authors,source,publish_date,movies,images,canonical_link,meta_data,original_sentiment,num_words,avg_sentiment_per_word,avg_generated_sentiment_temp0,avg_num_words_gen_temp0,avg_gen_sentiment_per_word_temp0,avg_generated_sentiment_temp0.5,avg_num_words_gen_temp0.5,avg_gen_sentiment_per_word_temp0.5,avg_generated_sentiment_temp1,avg_num_words_gen_temp1,avg_gen_sentiment_per_word_temp1,diff_sentiment_temp0,diff_sentiment_temp0.5,diff_sentiment_temp1,,,,,,,,
Real_48-Webpage,"Clinton: Tulsa shooting 'unbearable,' should be 'intolerable'","(CNN) Hillary Clinton's campaign manager said Wednesday that the Democratic nominee would implement a set of best practices to prevent police-involved shootings like the ones this week in Charlotte, North Carolina and Tulsa, Oklahoma.

""There are two prongs to her approach,"" Robby Mook, Hillary for America campaign manager told CNN's Alisyn Camerota on ""New Day."" ""The first is to have a set of national standards around how to manage the situations that doesn't exist right now and that could help through training to prevent situations like this.""

""There are no set of national best practices on how to manage situations,"" he continued. ""These situations are handled by local policies currently. And what she is proposing is that we actually set up national standards so that localities have better policies to work with and train towards.""

Clinton spoke out Tuesday against ""systematic racism"" following the recent shooting of Terence Crutcher in Tulsa, Oklahoma. Crutcher was shot and killed last week after his car broke down. The 40-year-old black man raised his hands above his head just before Officer Betty Shelby fatally shot him. Crutcher was unarmed at the time.

The Charlotte-Mecklenburg Police Department said Wednesday that ""approximately 12 officers"" were injured during protests after the fatal shooting of Keith Lamont Scott Tuesday by a police officer.

Mook said the other part of Clinton's plans involves working to improve the relationship between police and minorities.

""The second piece is to restore bonds between communities and law enforcement, so investing in community policing and making sure that local police have the resources to build the resources in the community to prevent something like this from happening,"" he said.

Clinton told radio host Steve Harvey on Tuesday's ""The Steve Harvey Morning Show"" that she plans to speak ""directly to white people"" about implicit bias. Mook said Wednesday Clinton meant she would explain that different ethnic groups are often treated differently in America.

""What she's saying is our entire country needs to do some real soul-searching here. It is clear that the criminal justice system is not treating everybody the same way,"" he said. ""If you are African-American or from a minority group, you may not be being treated the same as a white person. And that's a problem.""

Clinton said Tuesday that while there are ""good, honorable, cool-headed police officers"" working across the country, ""we can do better.""

""We have got to tackle systemic racism,"" Clinton said. ""This horrible shooting again. How many times do we have to see this in our country?""

""This is just unbearable,"" Clinton said. ""And it needs to be intolerable.""

Clinton later tweeted on the shooting, writing, ""Another unarmed Black man was shot in a police incident. This should be intolerable. We have so much work to do. #TerenceCrutcher -H.""

Another unarmed Black man was shot in a police incident. This should be intolerable. We have so much work to do. #TerenceCrutcher -H — Hillary Clinton (@HillaryClinton) September 20, 2016

In response to the Crutcher shooting, both the Department of Justice and state authorities have launched investigations into the officer-involved shooting.

Danny C. Williams, US Attorney of the Northern District of Oklahoma, said prosecutors will attempt to determine whether a federal civil rights violation had occurred. Authorities refused to immediately answer additional questions due to the ongoing investigation.",http://cnn.it/2cQyS4N,http://i2.cdn.cnn.com/cnnnext/dam/assets/160917174321-hillary-clinton-left-super-tease.jpg,"Dan Merica,Eugene Scott",http://cnn.it,,,"http://i2.cdn.cnn.com/cnnnext/dam/assets/160919225954-tulsa-shooting-1-large-169.jpg,http://i2.cdn.cnn.com/cnnnext/dam/assets/161118161709-cop-punches-woman-in-face-thumb-1-large-169.jpg,http://i2.cdn.cnn.com/cnnnext/dam/assets/170718110446-02-officer-mohamed-noor-large-169.jpg,http://i2.cdn.cnn.com/cnnnext/dam/assets/170717224427-justine-ruszczyk-large-169.jpg,http://i2.cdn.cnn.com/cnnnext/dam/assets/170711043320-georgia-police-beating-jnd-orig-vstop-00000612-large-169.jpg,http://i2.cdn.cnn.com/cnnnext/dam/assets/170104090632-north-carolina-school-body-slam-large-169.jpg,http://i2.cdn.cnn.com/cnnnext/dam/assets/170720014308-baltimore-pd-body-cam-video-release-02-large-169.jpg,data:image/gif;base64,R0lGODlhEAAJAJEAAAAAAP///////wAAACH5BAEAAAIALAAAAAAQAAkAAAIKlI+py+0Po5yUFQA7,http://i2.cdn.cnn.com/cnnnext/dam/assets/170626185531-jordan-edwards-roy-oliver-split-large-169.jpg,http://i2.cdn.cnn.com/cnnnext/dam/assets/170712182221-florida-state-attorney-aramis-ayala-large-169.jpg,http://i2.cdn.cnn.com/cnnnext/dam/assets/170818111936-dashcam-video-ohio-violent-arrest-large-169.jpg,http://i2.cdn.cnn.com/cnnnext/dam/assets/160707080401-philando-castile-facebook-2-large-169.jpg,http://i2.cdn.cnn.com/cnnnext/dam/assets/160520225617-georgia-man-tased-death-police-pkg-00012201-large-169.jpg,http://i2.cdn.cnn.com/cnnnext/dam/assets/170717113139-australian-woman-minneapolis-police-shooting-nr-00000812-large-169.jpg,http://i2.cdn.cnn.com/cnnnext/dam/assets/170718090944-betsy-hodges-7-18-large-169.jpg,http://i2.cdn.cnn.com/cnnnext/dam/assets/170712054244-louisiana-couple-police-shooting-large-169.jpg,http://i2.cdn.cnn.com/cnnnext/dam/assets/160917174321-hillary-clinton-left-super-tease.jpg,http://i2.cdn.cnn.com/cnnnext/dam/assets/160428084627-baltimore-teen-replica-gun-shot-dnt-00001823-large-169.jpg,http://i2.cdn.cnn.com/cnnnext/dam/assets/160919225954-tulsa-shooting-1-exlarge-169.jpg",http://www.cnn.com/2016/09/20/politics/terence-crutcher-tulsa-shooting-hillary-clinton/index.html,"{""description"": ""Hillary Clinton's campaign manager said Wednesday that the Democratic nominee would implement a set of best practices to prevent police-involved shootings like the ones this week in Charlotte, North Carolina and Tulsa, Oklahoma."", ""pubdate"": ""2016-09-20T15:39:52Z"", ""author"": ""Eugene Scott and Dan Merica, CNN"", ""og"": {""site_name"": ""CNN"", ""description"": ""Hillary Clinton's campaign manager said Wednesday that the Democratic nominee would implement a set of best practices to prevent police-involved shootings like the ones this week in Charlotte, North Carolina and Tulsa, Oklahoma."", ""pubdate"": ""2016-09-20T15:39:52Z"", ""title"": ""Clinton plans to develop national standards to manage police shootings"", ""url"": ""http://www.cnn.com/2016/09/20/politics/terence-crutcher-tulsa-shooting-hillary-clinton/index.html"", ""image"": {""width"": 1100, ""identifier"": ""http://i2.cdn.cnn.com/cnnnext/dam/assets/160917174321-hillary-clinton-left-super-tease.jpg"", ""height"": 619}, ""type"": ""article""}, ""section"": ""politics"", ""fb"": {""app_id"": 80401312489, ""pages"": ""5550296508,18793419640""}, ""thumbnail"": ""http://i2.cdn.cnn.com/cnnnext/dam/assets/160917174321-hillary-clinton-left-super-tease.jpg"", ""template-top"": ""politics,bra-2016-elections,art-vid-col,col-controversial-police-incidents-"", ""vr"": {""canonical"": ""http://www.cnn.com/2016/09/20/politics/terence-crutcher-tulsa-shooting-hillary-clinton/index.html""}, ""keywords"": ""Hillary Clinton, Clinton, Election 2016, US election, Tulsa, shooting, politics, Clinton: Tulsa shooting 'unbearable,' should be 'intolerable' - CNNPolitics"", ""article"": {""author"": ""https://www.facebook.com/EugeneScott202""}, ""lastmod"": ""2016-09-21T14:20:33Z"", ""twitter"": {""image"": ""http://i2.cdn.cnn.com/cnnnext/dam/assets/160917174321-hillary-clinton-left-super-tease.jpg"", ""description"": ""Hillary Clinton's campaign manager said Wednesday that the Democratic nominee would implement a set of best practices to prevent police-involved shootings like the ones this week in Charlotte, North Carolina and Tulsa, Oklahoma."", ""card"": ""summary_large_image"", ""title"": ""Clinton plans to develop national standards to manage police shootings""}, ""viewport"": ""width=device-width, initial-scale=1.0, minimum-scale=1.0""}",-5,656,-0.007621951,-15,723.4,-0.020622279,-20.4,732.6,-0.027713012,-11.6,716,-0.015869696,0.013000328,0.020091061,0.008247745,,,,,,,,
Real_49-Webpage,Conway: Trump will explain his Islamic State plan if asked,"Conway: Trump will explain his Islamic State plan if asked

Donald Trump will detail his plan to destroy the Islamic State during Monday night’s debate against Hillary Clinton — if asked, according to his campaign manager.

Asked by Willie Geist during MSNBC’s “Morning Joe” whether Trump will offer specifics beyond his broad statement that he will “knock the hell out of ISIS,” Trump campaign manager Kellyanne Conway replied in the affirmative.

Story Continued Below

“He certainly has a plan. I’ve heard it,” Conway said. “This is his debate tonight, Willie, he’ll tell you if that question is asked. But there’s also — you know, people are just amazed that Hillary Clinton would put on her campaign website what her plan to defeat ISIS is. Is it that ISIS can’t read that plan?”

Trump has vowed to “knock the hell out of ISIS” but has been mum on how he would do so, suggesting that he doesn’t want to tip his hand to the terrorist network.

Pressed by Geist and Mika Brzezinski on whether voters deserve to know details about his plan before they cast their votes, or at least a sense that he has any “knowledge of the landscape,” Conway said, “Yes, and he’ll be happy to offer those specifics without telling the enemy exactly what we’re going to do.”

“So just to put a button on it, we’ll get the ISIS plan tonight in the debate?” Geist asked.

“You will get his view of how best to defeat the enemy without telling ISIS particularly, specifically what it’s going to be,” she said.

Authors:",http://politi.co/2dm2wkm,http://v.politico.com/images/1155968404/201609/2196/1155968404_5141438661001_5141427952001-vs.jpg?pubId=1155968404,"Jack Shafer,Nolan D",http://politi.co,{'$date': 1474874720000},,"http://v.politico.com/images/1155968404/201609/2196/1155968404_5141438661001_5141427952001-vs.jpg?pubId=1155968404,data:image/gif;base64,R0lGODlhAQABAAAAACH5BAEKAAEALAAAAAABAAEAAAICTAEAOw==",http://www.politico.com/story/2016/09/trump-islamic-state-plan-first-2016-debate-228660,"{""description"": ""\u201cHe certainly has a plan. I\u2019ve heard it,\u201d Conway says."", ""og"": {""site_name"": ""POLITICO"", ""description"": ""\u201cHe certainly has a plan. I\u2019ve heard it,\u201d Conway says."", ""title"": ""Conway: Trump will explain his Islamic State plan if asked"", ""url"": ""http://politi.co/2dkAYvx"", ""image"": ""http://v.politico.com/images/1155968404/201609/2196/1155968404_5141438661001_5141427952001-vs.jpg?pubId=1155968404"", ""fb_appid"": 114037015331397, ""type"": ""article""}, ""twitter"": {""site"": ""@politico"", ""card"": ""summary_large_image"", ""creator"": ""@politico""}, ""host"": ""www.politico.com"", ""fb"": {""pages"": 62317591679}, ""build"": ""release/2017-maria 4b1f874 2017-08-24T15:20:21Z"", ""article"": {""author"": ""https://www.facebook.com/NolanDMcCaskill""}, ""viewport"": ""width=device-width, initial-scale=1""}",-11,331,-0.033232628,-7.6,307,-0.025014775,-1.2,307.2,-0.0035326,-1.6,308,-0.005525664,0.008217853,0.029700028,0.027706965,,,,,,,,
Real_5-Webpage,Obama in NYC: 'We all have a role to play' in terror fight after suspected bombings,"Story highlights Obams reaffirms US commitment to fighting ISIS

Obama praised the response from citizens in New York and New Jersey

New York (CNN) President Barack Obama worked to calm Americans' jitters Monday after a series of attempts at mass violence, suggesting that yielding to fear amounted to a win for terrorists.

During two appearances in New York, Obama praised the swift work of law enforcement authorities looking into duel bomb attacks in New York and New Jersey over the weekend. And he urged Americans to follow the lead of residents here by not submitting to fear.

""I think it is important to remember what terrorists and violent extremists are trying to do. They are trying to hurt innocent people, but they also want to inspire fear in all of us, and disrupt the way we live to undermine our values,"" Obama said. ""We all have a role to play as citizens in making sure that we don't succumb to that fear. And there is no better example of that than the people of New York and New Jersey.""

""Folks around here, you know, they don't get scared. They are tough, they are resilient, they go about their business every single day. And that kind of toughness and resoluteness and a recognition that neither individuals nor organizations like ISIL can ultimately undermine our way of life,"" Obama said. ""That's the kind of strength that makes me so proud to be an American.""

The President was speaking Monday morning from a hotel in midtown Manhattan, where he's attending his final United Nations General Assembly meeting. Two miles south, in Chelsea, investigations were still piecing together evidence following a bomb explosion in a dumpster Saturday night, which injured dozens.

Read More",http://cnn.it/2cTtbDk,http://i2.cdn.cnn.com/cnnnext/dam/assets/160919112740-obama-nj-ny-blast-super-tease.jpg,"Kevin Liptak,Cnn White House Producer",http://cnn.it,,,"http://i2.cdn.cnn.com/cnnnext/dam/assets/160919121108-07-rahami-capture-large-169.jpg,http://i2.cdn.cnn.com/cnnnext/dam/assets/160920115450-rahami-dad-large-169.jpg,http://i2.cdn.cnn.com/cnnnext/dam/assets/160919203658-harinder-bains-large-169.jpg,http://i2.cdn.cnn.com/cnnnext/dam/assets/160918063942-chelsea-explosion-large-169.jpg,http://i2.cdn.cnn.com/cnnnext/dam/assets/160917233934-13-chelsea-explosion-gettyimages-607368878-large-169.jpg,http://i2.cdn.cnn.com/cnnnext/dam/assets/160919163910-donald-trump-estero-rally-large-169.jpg,http://i2.cdn.cnn.com/cnnnext/dam/assets/160919132610-elizabeth-new-jersey-mayor-sot-00002609-large-169.jpg,http://i2.cdn.cnn.com/cnnnext/dam/assets/160917214152-donald-trump-bomb-new-york-00000000-large-169.jpg,http://i2.cdn.cnn.com/cnnnext/dam/assets/160919115924-05-rahami-capture-large-169.jpg,http://i2.cdn.cnn.com/cnnnext/dam/assets/160918112909-11-chelsea-explosion-large-169.jpg,http://i2.cdn.cnn.com/cnnnext/dam/assets/160929184402-ny-bomb-suspect-ahmad-rahami-train-perez-tsr-sot-00001005-large-169.jpg,http://i2.cdn.cnn.com/cnnnext/dam/assets/160918042036-clinton-nyc-explosion-reax-large-169.jpg,http://i2.cdn.cnn.com/cnnnext/dam/assets/160919125734-abel-andrew-large-169.jpg,http://i2.cdn.cnn.com/cnnnext/dam/assets/160919112740-obama-nj-ny-blast-super-tease.jpg,http://i2.cdn.cnn.com/cnnnext/dam/assets/160919144313-ahmad-khan-rahami-captured-orig-mg-00000000-large-169.jpg,http://i2.cdn.cnn.com/cnnnext/dam/assets/160919162859-new-york-explosion-investigation-bombing-ahmad-khan-rahami-griffin-dnt-lead-00001110-large-169.jpg,http://i2.cdn.cnn.com/cnnnext/dam/assets/160918110500-01-chelsea-explosion-0918-large-169.jpg,http://i2.cdn.cnn.com/cnnnext/dam/assets/160917222630-new-york-explosion-witness-comments-sot-00004505-large-169.jpg,http://i2.cdn.cnn.com/cnnnext/dam/assets/160919120832-bombing-suspect-rahami-in-custody-ambulance-vo-ath-00001824-large-169.jpg,http://i2.cdn.cnn.com/cnnnext/dam/assets/160917220554-05-chelsea-explosion-large-169.jpeg,http://i2.cdn.cnn.com/cnnnext/dam/assets/160921121241-fbi-chelsea-witnesses-large-169.jpg,data:image/gif;base64,R0lGODlhEAAJAJEAAAAAAP///////wAAACH5BAEAAAIALAAAAAAQAAkAAAIKlI+py+0Po5yUFQA7,http://i2.cdn.cnn.com/cnnnext/dam/assets/160919112740-obama-nj-ny-blast-exlarge-169.jpg,http://i2.cdn.cnn.com/cnnnext/dam/assets/160918010720-pressure-cooker-device-nyc-large-169.jpeg,http://i2.cdn.cnn.com/cnnnext/dam/assets/160920023329-new-video-appears-to-show-bombings-suspect-ahmad-rahami-vause-nr-00001608-large-169.jpg,http://i2.cdn.cnn.com/cnnnext/dam/assets/160920073933-harinder-baines-rahami-police-shootout-sot-newday-00003109-large-169.jpg,http://i2.cdn.cnn.com/cnnnext/dam/assets/160919112740-obama-nj-ny-blast-large-169.jpg",http://www.cnn.com/2016/09/19/politics/obama-to-us-dont-succumb-to-that-fear-following-suspected-bombing-incidents/index.html,"{""description"": ""President Barack Obama worked to calm Americans' jitters Monday after a series of attempts at mass violence, suggesting that yielding to fear amounted to a win for terrorists."", ""pubdate"": ""2016-09-19T15:38:12Z"", ""author"": ""Kevin Liptak, CNN White House Producer"", ""og"": {""site_name"": ""CNN"", ""description"": ""President Barack Obama worked to calm Americans' jitters Monday after a series of attempts at mass violence, suggesting that yielding to fear amounted to a win for terrorists."", ""pubdate"": ""2016-09-19T15:38:12Z"", ""title"": ""Obama: 'We all have a role to play' in terror fight"", ""url"": ""http://www.cnn.com/2016/09/19/politics/obama-to-us-dont-succumb-to-that-fear-following-suspected-bombing-incidents/index.html"", ""image"": {""width"": 1100, ""identifier"": ""http://i2.cdn.cnn.com/cnnnext/dam/assets/160919112740-obama-nj-ny-blast-super-tease.jpg"", ""height"": 619}, ""type"": ""article""}, ""section"": ""politics"", ""fb"": {""app_id"": 80401312489, ""pages"": ""5550296508,18793419640""}, ""thumbnail"": ""http://i2.cdn.cnn.com/cnnnext/dam/assets/160919112740-obama-nj-ny-blast-super-tease.jpg"", ""template-top"": ""politics,art-vid-vls-col,col-new-york-explosion"", ""vr"": {""canonical"": ""http://www.cnn.com/2016/09/19/politics/obama-to-us-dont-succumb-to-that-fear-following-suspected-bombing-incidents/index.html""}, ""keywords"": ""politics, Obama in NYC: 'We all have a role to play' in terror fight after suspected bombings - CNNPolitics"", ""lastmod"": ""2016-09-19T21:51:47Z"", ""twitter"": {""image"": ""http://i2.cdn.cnn.com/cnnnext/dam/assets/160919112740-obama-nj-ny-blast-super-tease.jpg"", ""description"": ""President Barack Obama worked to calm Americans' jitters Monday after a series of attempts at mass violence, suggesting that yielding to fear amounted to a win for terrorists."", ""card"": ""summary_large_image"", ""title"": ""Obama: 'We all have a role to play' in terror fight""}, ""viewport"": ""width=device-width, initial-scale=1.0, minimum-scale=1.0""}",-6,331,-0.018126888,-2.8,310,-0.008831146,2,322.6,0.006176169,8.2,315.6,0.026503707,0.009295743,0.024303057,0.044630595,,,,,,,,
Real_51-Webpage,Trump labels Clinton 'weak and ineffective' in wake of bombings,"Story highlights Donald Trump criticized Hillary Clinton for her approach to national security issues

It's a recurring theme of his campaign

Estero, Florida (CNN) Donald Trump, speaking two days after the latest terrorist attack on US soil, sought to paint his rival Hillary Clinton as a ""weak and ineffective"" leader not prepared to confront the threat of radical Islamic terrorism, as he talked up his radical policy prescriptions.

The Republican presidential nominee, addressing more than 8,000 people at his first rally since the bomb attacks in New York and New Jersey, talked up his hardline immigration policies, argued domestic terror suspects, even US citizens, should be tried as ""foreign enemy combatants"" -- rather than receive due process under US law.

He also slammed Clinton for what he said was being tougher on his supporters than on Islamist terrorism.

""Hillary Clinton talks tougher about my supporters than she does about radical Islamic terrorists,"" Trump said, pointing to Clinton's comments that half his supporters belong in a ""basket of deplorables.""

""Has she ever talked that way about radical Islam? No,"" Trump said. ""Are those words reserved only for hard-working Americans who truly love our country and they want to make a statement? One can be forgiven for getting the impression that these hardworking Americans are somehow a greater threat to our country than these Islamic extremists.""

Read More",http://cnn.it/2d6LAP3,http://i2.cdn.cnn.com/cnnnext/dam/assets/160725062455-donald-trump-hillary-clinton-composite-super-tease.jpg,Jeremy Diamond,http://cnn.it,,,"http://i2.cdn.cnn.com/cnnnext/dam/assets/160725062455-donald-trump-hillary-clinton-composite-super-tease.jpg,http://i2.cdn.cnn.com/cnnnext/dam/assets/161028221651-donald-trump-cedar-rapids-large-169.jpg,http://i2.cdn.cnn.com/cnnnext/dam/assets/161102201935-donald-trump-nice-and-cool-pensacola-fl-bts-00001523-large-169.jpg,http://i2.cdn.cnn.com/cnnnext/dam/assets/161105200544-donald-trump-new-hampshire-1104-large-169.jpg,http://i2.cdn.cnn.com/cnnnext/dam/assets/160508133659-trump-0507-large-169.jpg,http://i2.cdn.cnn.com/cnnnext/dam/assets/161106045701-03-trump-reno-1105-large-169.jpg,http://i2.cdn.cnn.com/cnnnext/dam/assets/160908095621-trump-obama-hp-split-0908-large-169.jpg,http://i2.cdn.cnn.com/cnnnext/dam/assets/161101000626-the-other-hillary-clinton-large-169.jpg,http://i2.cdn.cnn.com/cnnnext/dam/assets/160919163910-donald-trump-estero-rally-exlarge-169.jpg,data:image/gif;base64,R0lGODlhEAAJAJEAAAAAAP///////wAAACH5BAEAAAIALAAAAAAQAAkAAAIKlI+py+0Po5yUFQA7,http://i2.cdn.cnn.com/cnnnext/dam/assets/161118080613-donald-trump-undocumented-immigrants-crime-fact-check-origwx-ty-00013807-large-169.jpg,http://i2.cdn.cnn.com/cnnnext/dam/assets/161125171933-trump-in-mideast-1-large-169.jpg,http://i2.cdn.cnn.com/cnnnext/dam/assets/161031105742-cuomo-lewandowski-hillary-clinton-email-exchange-newday-00002327-large-169.jpg,http://i2.cdn.cnn.com/cnnnext/dam/assets/161031175702-donald-trump-nice-to-hillary-clinton-and-democrats-orig-cm-00000000-large-169.jpg,http://i2.cdn.cnn.com/cnnnext/dam/assets/160919163910-donald-trump-estero-rally-large-169.jpg,http://i2.cdn.cnn.com/cnnnext/dam/assets/161107215031-trump-brady-belichick-composite-large-169.jpg,http://i2.cdn.cnn.com/cnnnext/dam/assets/161128211330-jill-stein-new-large-169.jpg,http://i2.cdn.cnn.com/cnnnext/dam/assets/161111132518-04-week-in-politics-1113-large-169.jpg",http://www.cnn.com/2016/09/19/politics/donald-trump-national-security-terrorism/index.html,"{""description"": ""Donald Trump, speaking two days after the latest terrorist attack on US soil, sought to paint his rival Hillary Clinton as a \""weak and ineffective\"" leader not prepared to confront the threat of radical Islamic terrorism, as he talked up his radical policy prescriptions."", ""pubdate"": ""2016-09-19T22:23:23Z"", ""author"": ""Jeremy Diamond, CNN"", ""og"": {""site_name"": ""CNN"", ""description"": ""Donald Trump, speaking two days after the latest terrorist attack on US soil, sought to paint his rival Hillary Clinton as a \""weak and ineffective\"" leader not prepared to confront the threat of radical Islamic terrorism, as he talked up his radical policy prescriptions."", ""pubdate"": ""2016-09-19T22:23:23Z"", ""title"": ""Trump labels Clinton 'weak and ineffective' in wake of bombings"", ""url"": ""http://www.cnn.com/2016/09/19/politics/donald-trump-national-security-terrorism/index.html"", ""image"": {""width"": 1100, ""identifier"": ""http://i2.cdn.cnn.com/cnnnext/dam/assets/160725062455-donald-trump-hillary-clinton-composite-super-tease.jpg"", ""height"": 619}, ""type"": ""article""}, ""section"": ""politics"", ""fb"": {""app_id"": 80401312489, ""pages"": ""5550296508,18793419640""}, ""thumbnail"": ""http://i2.cdn.cnn.com/cnnnext/dam/assets/160725062455-donald-trump-hillary-clinton-composite-super-tease.jpg"", ""template-top"": ""politics,bra-2016-elections,art-vid-vls-col,col-donald-trump"", ""vr"": {""canonical"": ""http://www.cnn.com/2016/09/19/politics/donald-trump-national-security-terrorism/index.html""}, ""keywords"": ""politics, Trump labels Clinton 'weak and ineffective' in wake of bombings - CNNPolitics"", ""lastmod"": ""2016-09-19T22:37:46Z"", ""twitter"": {""image"": ""http://i2.cdn.cnn.com/cnnnext/dam/assets/160725062455-donald-trump-hillary-clinton-composite-super-tease.jpg"", ""description"": ""Donald Trump, speaking two days after the latest terrorist attack on US soil, sought to paint his rival Hillary Clinton as a \""weak and ineffective\"" leader not prepared to confront the threat of radical Islamic terrorism, as he talked up his radical policy prescriptions."", ""card"": ""summary_large_image"", ""title"": ""Trump labels Clinton 'weak and ineffective' in wake of bombings""}, ""viewport"": ""width=device-width, initial-scale=1.0, minimum-scale=1.0""}",-16,262,-0.061068702,-17.2,247,-0.069449622,-17.6,243.8,-0.072384461,-18,244.4,-0.07393655,0.00838092,0.011315759,0.012867848,,,,,,,,
