id,title,text,url,top_img,authors,source,publish_date,movies,images,canonical_link,meta_data,original_sentiment,num_words,avg_sentiment_per_word,avg_generated_sentiment_temp0,avg_num_words_gen_temp0,avg_gen_sentiment_per_word_temp0,avg_generated_sentiment_temp0.5,avg_num_words_gen_temp0.5,avg_gen_sentiment_per_word_temp0.5,avg_generated_sentiment_temp1,avg_num_words_gen_temp1,avg_gen_sentiment_per_word_temp1,diff_sentiment_temp0,diff_sentiment_temp0.5,diff_sentiment_temp1,,,,,,,,
Real_1-Webpage,Another Terrorist Attack in NYC…Why Are we STILL Being Politically Correct – Eagle Rising,"On Saturday, September 17 at 8:30 pm EST, an explosion rocked West 23 Street in Manhattan, in the neighborhood commonly referred to as Chelsea, injuring 29 people, smashing windows and initiating street closures. There were no fatalities. Officials maintain that a homemade bomb, which had been placed in a dumpster, created the explosion. The explosive device was removed by the police at 2:25 am and was sent to a lab in Quantico, Virginia for analysis. A second device, which has been described as a “pressure cooker” device similar to the device used for the Boston Marathon bombing in 2013, was found on West 27th Street between the Avenues of the Americas and Seventh Avenue. By Sunday morning, all 29 people had been released from the hospital. The Chelsea incident came on the heels of an incident Saturday morning in Seaside Heights, New Jersey where a bomb exploded in a trash can along a route where thousands of runners were present to run a 5K Marine Corps charity race. There were no casualties. By Sunday afternoon, law enforcement had learned that the NY and NJ explosives were traced to the same person.

Given that we are now living in a world where acts of terrorism are increasingly more prevalent, when a bomb goes off, our first thought usually goes to the possibility of terrorism. After all, in the last year alone, we have had several significant incidents with a massive number of casualties and injuries in Paris, San Bernardino California, Orlando Florida and Nice, to name a few. And of course, last week we remembered the 15th anniversary of the September 11, 2001 attacks where close to 3,000 people were killed at the hands of terrorists. However, we also live in a world where political correctness is the order of the day and the fear of being labeled a racist supersedes our natural instincts towards self-preservation which, of course, includes identifying the evil-doers. Isn’t that how crimes are solved? Law enforcement tries to identify and locate the perpetrators of the crime or the “bad guys.” Unfortunately, our leadership – who ostensibly wants to protect us – finds their hands and their tongues tied. They are not allowed to be specific about their potential hypotheses for fear of offending anyone.

New York City Mayor Bill de Blasio – who famously ended “stop-and-frisk” profiling in his city – was extremely cautious when making his first remarks following the Chelsea neighborhood explosion. “There is no specific and credible threat to New York City from any terror organization,” de Blasio said late Saturday at the news conference. “We believe at this point in this time this was an intentional act. I want to assure all New Yorkers that the NYPD and … agencies are at full alert”, he said. Isn’t “an intentional act” terrorism? We may not know whether it is from an international terrorist group such as ISIS, or a homegrown terrorist organization or a deranged individual or group of individuals. It is still terrorism. It is not an accident. James O’Neill, the New York City Police Commissioner had already ruled out the possibility that the explosion was caused by a natural gas leak at the time the Mayor made his comments. New York’s Governor Andrew Cuomo was a little more direct than de Blasio saying that there was no evidence of international terrorism and that no specific groups had claimed responsibility. However, he did say that it is a question of how the word “terrorism” is defined. “A bomb exploding in New York is obviously an act of terrorism.” Cuomo hit the nail on the head, but why did need to clarify and caveat before making his “obvious” assessment?

The two candidates for president Hillary Clinton and Donald Trump also weighed in on the Chelsea explosion. Clinton was very generic in her response saying that “we need to do everything we can to support our first responders – also to pray for the victims” and that “we need to let this investigation unfold.” Trump was more direct. “I must tell you that just before I got off the plane a bomb went off in New York and nobody knows what’s going on,” he said. “But boy we are living in a time—we better get very tough folks. We better get very, very tough. It’s a terrible thing that’s going on in our world, in our country and we are going to get tough and smart and vigilant.”

Unfortunately, an incident like the Chelsea explosion reminds us how vulnerable our country is particularly in venues defined as “soft targets.” Now more than ever, America needs strong leadership which is laser-focused on protecting her citizens from terrorist attacks of all genres and is not afraid of being politically incorrect.

The views expressed in this opinion article are solely those of their author and are not necessarily either shared or endorsed by EagleRising.com",http://eaglerising.com/36942/another-terrorist-attack-in-nyc-why-are-we-still-being-politically-correct/,http://eaglerising.com/wp-content/uploads/2016/09/terrorism-2.jpg,"View All Posts,Leonora Cravotta",http://eaglerising.com,{'$date': 1474528230000},,"http://constitution.com/wp-content/uploads/2017/08/confederatemonument_poll_pop.jpg,http://2lv0hm3wvpix464wwy2zh7d1.wpengine.netdna-cdn.com/wp-content/uploads/wordpress-popular-posts/46772-featured-300x130.jpg,http://2lv0hm3wvpix464wwy2zh7d1.wpengine.netdna-cdn.com/wp-content/uploads/2016/03/eagle-rising-logo3-1.png,http://2lv0hm3wvpix464wwy2zh7d1.wpengine.netdna-cdn.com/wp-content/uploads/wordpress-popular-posts/46729-featured-300x130.jpg,http://2lv0hm3wvpix464wwy2zh7d1.wpengine.netdna-cdn.com/wp-content/uploads/wordpress-popular-posts/46764-featured-300x130.jpg,http://2lv0hm3wvpix464wwy2zh7d1.wpengine.netdna-cdn.com/wp-content/uploads/wordpress-popular-posts/46731-featured-300x130.jpg,http://pixel.quantserve.com/pixel/p-52ePUfP6_NxQ_.gif,http://0.gravatar.com/avatar/9b4601287436c60e1c7c5b65d725151f?s=112&d=mm&r=g,http://b.scorecardresearch.com/p?c1=2&c2=22315475&cv=2.0&cj=1,http://2lv0hm3wvpix464wwy2zh7d1.wpengine.netdna-cdn.com/wp-content/uploads/wordpress-popular-posts/46784-featured-300x130.png,http://2lv0hm3wvpix464wwy2zh7d1.wpengine.netdna-cdn.com/wp-content/uploads/2016/09/terrorism-2-800x300.jpg,http://2lv0hm3wvpix464wwy2zh7d1.wpengine.netdna-cdn.com/wp-content/uploads/2016/09/coup-375x195.jpg,http://2lv0hm3wvpix464wwy2zh7d1.wpengine.netdna-cdn.com/wp-content/uploads/2017/04/crtv_300x600_1.jpg,http://2lv0hm3wvpix464wwy2zh7d1.wpengine.netdna-cdn.com/wp-content/uploads/wordpress-popular-posts/46774-featured-300x130.jpg,http://2lv0hm3wvpix464wwy2zh7d1.wpengine.netdna-cdn.com/wp-content/uploads/2016/09/superstar-375x195.jpg,http://2lv0hm3wvpix464wwy2zh7d1.wpengine.netdna-cdn.com/wp-content/uploads/wordpress-popular-posts/46763-featured-300x130.jpg,http://2lv0hm3wvpix464wwy2zh7d1.wpengine.netdna-cdn.com/wp-content/uploads/wordpress-popular-posts/46612-featured-300x130.jpg,http://2lv0hm3wvpix464wwy2zh7d1.wpengine.netdna-cdn.com/wp-content/uploads/wordpress-popular-posts/46761-featured-300x130.jpg,http://2lv0hm3wvpix464wwy2zh7d1.wpengine.netdna-cdn.com/wp-content/uploads/wordpress-popular-posts/46642-featured-300x130.jpg,http://2lv0hm3wvpix464wwy2zh7d1.wpengine.netdna-cdn.com/wp-content/uploads/wordpress-popular-posts/46735-featured-300x130.jpg,http://2lv0hm3wvpix464wwy2zh7d1.wpengine.netdna-cdn.com/wp-content/uploads/wordpress-popular-posts/46750-featured-300x130.jpg,http://2lv0hm3wvpix464wwy2zh7d1.wpengine.netdna-cdn.com/wp-content/uploads/wordpress-popular-posts/46755-featured-300x130.jpg,http://2lv0hm3wvpix464wwy2zh7d1.wpengine.netdna-cdn.com/wp-content/uploads/wordpress-popular-posts/46752-featured-300x130.png,http://eaglerising.com/wp-content/uploads/2016/09/terrorism-2.jpg,http://2lv0hm3wvpix464wwy2zh7d1.wpengine.netdna-cdn.com/wp-content/uploads/wordpress-popular-posts/46743-featured-300x130.jpg,http://2lv0hm3wvpix464wwy2zh7d1.wpengine.netdna-cdn.com/wp-content/uploads/wordpress-popular-posts/46712-featured-300x130.jpg,http://0.gravatar.com/avatar/9b4601287436c60e1c7c5b65d725151f?s=100&d=mm&r=g,http://2lv0hm3wvpix464wwy2zh7d1.wpengine.netdna-cdn.com/wp-content/uploads/wordpress-popular-posts/46757-featured-300x130.png",http://eaglerising.com/36942/another-terrorist-attack-in-nyc-why-are-we-still-being-politically-correct/,"{""description"": ""\u201cWe believe at this point in this time this was an intentional act,\"" de Blasio said. Isn\u2019t \u201can intentional act\u201d terrorism?"", ""og"": {""site_name"": ""Eagle Rising"", ""description"": ""\u201cWe believe at this point in this time this was an intentional act,\"" de Blasio said. Isn\u2019t \u201can intentional act\u201d terrorism?"", ""title"": ""Another Terrorist Attack in NYC...Why Are we STILL Being Politically Correct"", ""locale"": ""en_US"", ""image"": ""http://eaglerising.com/wp-content/uploads/2016/09/terrorism-2.jpg"", ""updated_time"": ""2016-09-22T10:49:05+00:00"", ""url"": ""http://eaglerising.com/36942/another-terrorist-attack-in-nyc-why-are-we-still-being-politically-correct/"", ""type"": ""article""}, ""robots"": ""noimageindex"", ""fb"": {""app_id"": 256195528075351, ""pages"": 135665053303678}, ""article"": {""section"": ""Political Correctness"", ""tag"": ""terrorism"", ""published_time"": ""2016-09-22T07:10:30+00:00"", ""modified_time"": ""2016-09-22T10:49:05+00:00""}, ""viewport"": ""initial-scale=1,maximum-scale=1,user-scalable=no"", ""googlebot"": ""noimageindex""}",-43,930,-0.046236559,-12.8,878.2,-0.014429075,-3.8,865.2,-0.004420044,-19.6,880.2,-0.021729195,0.031807484,0.041816515,0.024507364,,,,,,,,
Real_10-Webpage,"Donald Trump: Drugs a 'Very, Very Big Factor' in Charlotte Protests","Less than a day after protests over the police killing of an African-American man turned violent in North Carolina, Republican presidential nominee Donald Trump placed some of the blame for the turmoil on the impact of drugs.

""If you're not aware, drugs are a very, very big factor in what you're watching on television at night,"" said Trump in a speech to the Shale Insight 2016 Conference in Pittsburgh today.

On Wednesday night, Charlotte experienced its second night of protests after the death of Keith Lamont Scott on Tuesday afternoon. Officers in riot gear confronted demonstrators in a downtown commercial area and employed tear gas to control crowds. One person is in critical condition after suffering an apparent gunshot wound.

The Republican nominee condemned the violence, calling for unity.

""Our country looks bad to the world, especially when we are supposed to be the world's leader. How can we lead when we can't even control our own cities? We honor and recognize the right of all Americans to peacefully assemble, protest and demonstrate, but there is no right to engage in violent disruption or to threaten the public safety and peace of others.""

He continued to praise law enforcement officers, citing the challenges they face and calling for better training.

""It's tough being a police officer,"" Trump said. ""Police are entrusted with immense responsibility, and we must do everything we can to ensure that they are properly trained, that they respect all members of the public and that any wrongdoing is always — and it will be by them — vigorously addressed.""

But aside from that one reference, amid his heavy-handed praise for law enforcement and condemnation of protesters, Trump never acknowledged any pattern of violence against African-Americans at the hands of police, which is precisely why so many protesters say they have taken to the streets. They cite the shooting deaths of dozens of other black Americans by police as cause to protest a system they say is dangerous and discriminatory and fails to prosecute far too many officers who kill African-Americans, in many instances unarmed.

Trump in recent days has appealed to black Americans, asking them what they have to lose by voting for him, even as he paints an exceptionally grim portrait of black poverty and crime.

During a rally earlier this week in North Carolina, Trump said, ""We're going to rebuild our inner cities because our African-American communities are absolutely in the worst shape they've ever been in before. Ever, ever, ever,""

Many African-Americans have bristled at that broad assertion. While many inner cities are plagued by crime and poverty, according to census data from 2015, 52.9 percent of black Americans age 25 or older hold some sort of college degree. A Pew report released in December shows that black adults experienced the largest income increase from 1971 to 2015 and were the only racial group to see a decrease in the percentage of low-income earners. And according to the Census Bureau, almost 73 percent of black Americans do not live in poverty.

Trump, in an effort to reach out to the black community, visited Cleveland earlier this week, appearing at a black church. And during a town hall on the Fox News Channel Wednesday night, he was asked about the threat of violence.

""I would do stop and frisk. I think you have to,"" said Trump. ""We did it in New York. It worked incredibly well. And you have to be proactive and, you know, you really help people sort of change their mind automatically.""

But this morning in an interview on ""Fox & Friends"" he stepped back from the statement, claiming he was referring to a strategy only for Chicago.

In Pittsburgh, Trump delineated a difference between what he called the ""violent disruptor"" and the rest of the black community. He said it was the country""s job ""to make life more comfortable for the African-American parent trying to raise their kids in peace, to walk their children to school and to get their children great educations.""",http://abcn.ws/2d4lNn9,http://a.abcnews.com/images/Politics/AP_donald_trump_2_jt_160826_16x9_992.jpg,"More Candace,Adam Kelsey,Abc News,More Adam",http://abcn.ws,,,"http://www.googleadservices.com/pagead/conversion/1005826543/?value=0&label=1GPKCOHYjwMQ7-PO3wM&guid=ON&script=0,http://a.abcnews.com/images/Politics/AP_donald_trump_2_jt_160826_12x5_992.jpg,http://secure-us.imrworldwide.com/cgi-bin/m?ci=us-704476h&cg=0&cc=1&ts=noscript,http://a.abcnews.com/images/Politics/AP_donald_trump_2_jt_160826_16x9_992.jpg",http://abcnews.go.com/Politics/donald-trump-drugs-big-factor-charlotte-protests/story?id=42282437,"{""fb_title"": ""Trump: Drugs a 'Very, Very Big Factor' in Charlotte Protests"", ""description"": ""The police-involved shooting of a black man has sparked protests in Charlotte."", ""copyright"": ""Copyright (c) 2017 ABC News Internet Ventures"", ""author"": ""ABC News"", ""og"": {""site_name"": ""ABC News"", ""description"": ""The police-involved shooting of a black man has sparked protests in Charlotte."", ""title"": ""Trump: Drugs a 'Very, Very Big Factor' in Charlotte Protests"", ""url"": ""http://abcnews.go.com/Politics/donald-trump-drugs-big-factor-charlotte-protests/story?id=42282437"", ""image"": ""http://a.abcnews.com/images/Politics/AP_donald_trump_2_jt_160826_16x9_992.jpg"", ""type"": ""article""}, ""twitter"": {""description"": ""The police-involved shooting of a black man has sparked protests in Charlotte."", ""title"": ""Trump: Drugs a 'Very, Very Big Factor' in Charlotte Protests"", ""url"": ""http://abcnews.go.com/Politics/donald-trump-drugs-big-factor-charlotte-protests/story?id=42282437"", ""image"": ""http://a.abcnews.com/images/Politics/AP_donald_trump_2_jt_160826_16x9_992.jpg"", ""creator"": ""@adam_kels"", ""site"": ""@ABC"", ""app"": {""url"": {""ipad"": ""abcnewsipad://link/story,42282437"", ""iphone"": ""abcnewsiphone://link/story,42282437"", ""googleplay"": ""android-app://com.abc.abcnews/abcnews/abcnews.go.com/Politics/donald-trump-drugs-big-factor-charlotte-protests/story?id=42282437""}, ""name"": {""ipad"": ""ABC News"", ""iphone"": ""ABC News"", ""googleplay"": ""ABC News""}, ""id"": {""ipad"": 306934135, ""iphone"": 300255638, ""googleplay"": ""com.abc.abcnews""}}, ""card"": ""summary_large_image""}, ""robots"": ""index, follow"", ""DC.date.issued"": ""2016-09-22"", ""al"": {""ipad"": {""url"": ""abcnewsipad://link/story,42282437"", ""app_store_id"": 380520716, ""app_name"": ""ABC News for iPad""}, ""web"": {""url"": ""http://abcnews.go.com/Politics/donald-trump-drugs-big-factor-charlotte-protests/story?id=42282437""}, ""android"": {""url"": ""android-app://com.abc.abcnews/abcnews/abcnews.go.com/Politics/donald-trump-drugs-big-factor-charlotte-protests/story?id=42282437"", ""app_name"": ""ABC News Breaking Latest News"", ""package"": ""com.abc.abcnews""}, ""iphone"": {""url"": ""abcnewsiphone://link/story,42282437"", ""app_store_id"": 300255638, ""app_name"": ""ABC News - Breaking US & World News""}}, ""Date"": ""2016-09-22"", ""fb"": {""admins"": 704409894, ""app_id"": 4942312939, ""pages"": 55845270277}, ""Last-Modified"": ""2016-09-22 14:33:00"", ""keywords"": ""Donald Trump, Keith Lamont Scott, Protests, Election 2016, Charlotte, Pittsburgh, politics news, election news, political news, political news articles"", ""viewport"": ""initial-scale=1.0, maximum-scale=1.0, user-scalable=no"", ""news_keywords"": ""Donald Trump, Keith Lamont Scott, Protests, Election 2016, Charlotte, Pittsburgh""}",-51,768,-0.06640625,-37.2,766.6,-0.048666666,-47,797.8,-0.05932357,-54,784.4,-0.069551357,0.017739584,0.00708268,0.003145107,,Per word,,Orig,Temp0,Temp0.5,Temp1,
Real_11-Webpage,"Obama To UN: ‘Giving Up Liberty, Enhances Security In America…’ [VIDEO]","Obama To UN: ‘Giving Up Liberty, Enhances Security In America…’ [VIDEO]

Freedom is the bedrock that this nation was built upon. The problem is, liberals hate freedom. Oh, sure — they pay lip service to its importance, but ultimately, they want people to be subservient to a liberal-controlled government. They may not want a tyrannical king, but a tyrannical government of socialist-loving politicians pushing government-controlled everything is A-OK with them. They can’t ever say this out loud, though. Which makes the speech Obama just gave to the United Nations rather surprising. Obama actually admitted that he thinks it’s necessary for the United States to give up a little liberty… you know, for “safety”.

Tuesday, Obama spoke to the United Nations General Assembly. “We can only realize the promise of this institution’s founding to replace the ravages of war with cooperation if powerful nations, like my own, accept constraints,” he said. “Sometimes I am criticized in my own country for professing a belief in international norms and multilateral institutions. But I am convinced in the long run, giving up some freedom of action, not giving up our ability to protect ourselves or pursue our core interests, but binding ourselves to the international rules over the long-term enhances our security.”

× 101 Things All Young Adults Should Know by Sir John Hawkins John Hawkins's book 101 Things All Young Adults Should Know is filled with lessons that newly minted adults need in order to get the most out of life. Gleaned from a lifetime of trial, error, and writing it down, Hawkins provides advice everyone can benefit from in short, digestible chapters. Buy Now

So evidently, Obama believes that we should relinquish more of our freedom and sovereignty so that the international community can rule over us. How this will make the country safer, he didn’t explain. But safety relies on us bringing more Muslim refugees into the United States. “Ultimately our world will be more secure if we are prepared to help those in need and the nations who are carrying the largest burden with respect to accommodating these refugees,” Obama said.

Obama may want to take a look at how Germany is doing. Accepting tons of refugees without screening them first has certainly not made their country safer — it’s made it more dangerous. And right here in the United States, we have had multiple terrorist attacks over the last year.

How allowing over 110,000 Muslim refugees with no vetting whatsoever into our country will keep us safe is not something that Obama can actually explain, because it’s a completely ludicrous idea. And turning the United States into a country that has to answer to the United Nations before we act on anything doesn’t make us safer, either. It’s a typical liberal idea: something that is nonsensical and useless, yet will weaken the country and strip Americans of their constitutionally-protected rights. But hey, who needs freedom, right? Obama has an agenda to push.",http://rightwingnews.com/barack-obama/obama-un-giving-liberty-enhances-security-america/,http://rightwingnews.com/wp-content/uploads/2016/09/obama-un.jpg,Cassy Fiano,http://rightwingnews.com,{'$date': 1474476044000},https://www.youtube.com/embed/ji6pl5Vwrvk,"http://rightwingnews.com/wp-content/uploads/2016/09/obama-un.jpg,http://rightwingnews.com/wp-content/uploads/wordpress-popular-posts/343883-featured-90x90.png,http://rightwingnews.com/wp-content/uploads/wordpress-popular-posts/343898-featured-90x90.jpg,http://pixel.quantserve.com/pixel/p-RS38vHsezmL8w.gif,http://rightwingnews.com/wp-content/uploads/wordpress-popular-posts/343804-featured-214x123.jpg,http://rightwingnews.com/wp-content/uploads/wordpress-popular-posts/343804-featured-90x90.jpg,http://rightwingnews.com/wp-content/uploads/wordpress-popular-posts/343898-featured-214x123.jpg,https://www.facebook.com/tr?ev=6026286623931&cd[value]=0.00&cd[currency]=USD&noscript=1,http://rightwingnews.com/wp-content/uploads/wordpress-popular-posts/343798-featured-90x90.jpg,http://rightwingnews.com/wp-content/uploads/2016/09/obama-un-890x395_c.jpg,http://rightwingnews.com/wp-content/uploads/wordpress-popular-posts/343798-featured-214x123.jpg,http://www.rightwingnews.com/wp-content/uploads/2014/08/rightwingnews_logo.png,http://rightwingnews.com/wp-content/themes/rightwingnews-theme/images/loading.gif,http://rightwingnews.com/wp-content/plugins/wpdev-content-ad/assets/book-ad.jpg,http://2.gravatar.com/avatar/8b602f8210f1a7d948ca1c0dcab11fad?s=96&d=mm&r=g,http://rightwingnews.com/wp-content/uploads/wordpress-popular-posts/343754-featured-90x90.jpg,http://2.gravatar.com/avatar/8b602f8210f1a7d948ca1c0dcab11fad?s=32&d=mm&r=g,http://rightwingnews.com/wp-content/uploads/wordpress-popular-posts/343754-featured-214x123.jpg,http://rightwingnews.com/wp-content/uploads/2016/09/ZObama.png,http://rightwingnews.com/wp-content/uploads/wordpress-popular-posts/343814-featured-214x123.jpg,http://rightwingnews.com/wp-content/uploads/wordpress-popular-posts/343883-featured-214x123.png,http://rightwingnews.com/wp-content/uploads/wordpress-popular-posts/343814-featured-90x90.jpg",http://rightwingnews.com/barack-obama/obama-un-giving-liberty-enhances-security-america/,"{""googlebot"": ""noimageindex"", ""og"": {""site_name"": ""John Hawkins' Right Wing News"", ""description"": ""Freedom is the bedrock that this nation was built upon. The problem is, liberals hate freedom. Oh, sure \u2014 they pay lip service to its importance, but ultimately, they want"", ""title"": ""Obama To UN: 'Giving Up Liberty, Enhances Security In America...' [VIDEO] | John Hawkins' Right Wing News"", ""locale"": ""en_US"", ""image"": {""width"": 640, ""identifier"": ""http://rightwingnews.com/wp-content/uploads/2016/09/obama-un.jpg"", ""height"": 480}, ""updated_time"": ""2016-09-21T17:46:06-04:00"", ""url"": ""http://rightwingnews.com/barack-obama/obama-un-giving-liberty-enhances-security-america/"", ""type"": ""article""}, ""referrer"": ""always"", ""robots"": ""noimageindex"", ""fb"": {""app_id"": 1631890973779575, ""pages"": 389658314427637}, ""article"": {""section"": ""Barack Obama"", ""published_time"": ""2016-09-21T12:40:44-04:00"", ""modified_time"": ""2016-09-21T17:46:06-04:00""}, ""google-site-verification"": ""SkBwg36QfD-9JmsE5roZWtBuTvXCuBAahBo8MiQVSEk"", ""viewport"": ""width=device-width, initial-scale=1""}",23,576,0.039930556,9.6,593.2,0.015953879,20,559.8,0.036041061,26.2,645.4,0.040521302,0.023976677,0.003889495,0.000590746,,Avg Sent,,-0.010553297,0.002058005,0.001416131,0.002062536,(AVERAGE)
