id,title,text,url,top_img,authors,source,publish_date,movies,images,canonical_link,meta_data,original_sentiment,num_words,avg_sentiment_per_word,avg_generated_sentiment_temp0,avg_num_words_gen_temp0,avg_gen_sentiment_per_word_temp0,avg_generated_sentiment_temp0.5,avg_num_words_gen_temp0.5,avg_gen_sentiment_per_word_temp0.5,avg_generated_sentiment_temp1,avg_num_words_gen_temp1,avg_gen_sentiment_per_word_temp1,diff_sentiment_temp0,diff_sentiment_temp0.5,diff_sentiment_temp1,,,,,,,,
Real_28-Webpage,“How Can we LEAD When we Can’t Even Control Our Own Cities?” [VIDEO] – Eagle Rising,"Donald Trump was in Pittsburgh, Pennsylvania Thursday for a campaign speech. He took time to address the unrest around the country in the wake of recent officer-involved shootings. Here’s what he said:

“Before going any further today, I want to address the turmoil unfolding right now in our country. And it seems to be a never-ending problem. America desperately needs unity, and it needs the spirit of togetherness, that has not only gotten us through our toughest times – because we’ve had some tough times – but which has lifted us up in the past to our greatest achievements as a nation.

“Everyday I see people of different backgrounds working together for common good, and we need to bring that spirit to every part of our country and become one American nation, united by shared values and principles as American citizens. We have to do it. And we have to respect our flag. We have to respect our flag.

“We all have to walk a mile in someone else’s shoes and see things through their eyes, and then get to work fixing our very wounded country. We have some real problems. And we do have a wounded country.

“Many Americans are watching the unrest in Charlotte unfolding right before their eyes on the TV screen. Others are witnessing the chaos and the violence firsthand. Our country looks bad to the world, especially when we are supposed to be the world’s leader. How can we lead when we can’t even control our own cities?

“We honor and recognize the right of all Americans to peacefully assemble, protest, and demonstrate. But there is no right to engage in violent disruption or to threaten the public safety and peace of others.

“Every single American in our country is entitled to live in a safe community. The violence against our citizens and our law enforcement must be brought to a very rapid end.

“The people who will suffer the most as a result of these riots are law-abiding African-American residents who live in these communities where the crime is so rampant. It’s their jobs, housing market, schools, economic conditions that will suffer. And the first duty of government is to protect their wellbeing and safety. We have to do that.

“There is no compassion in tolerating lawless conduct. Crime and violence is an attack on the poor and will never be accepted in a Trump administration.

“Our job is not to make life more comfortable for the violent disrupter, but to make life more comfortable for the African-American parent trying to raise their kids in peace, to walk their children to school and get their children great educations. We have to cherish and protect those people.”

The views expressed in this opinion article are solely those of their author and are not necessarily either shared or endorsed by EagleRising.com",http://eaglerising.com/36966/trump-how-can-we-lead-when-we-cant-even-control-our-own-cities-video/,http://eaglerising.com/wp-content/uploads/2016/09/trump-2.jpg,"Philip Hodges,View All Posts",http://eaglerising.com,{'$date': 1474615804000},,"http://constitution.com/wp-content/uploads/2017/08/confederatemonument_poll_pop.jpg,http://2lv0hm3wvpix464wwy2zh7d1.wpengine.netdna-cdn.com/wp-content/uploads/wordpress-popular-posts/46772-featured-300x130.jpg,http://2lv0hm3wvpix464wwy2zh7d1.wpengine.netdna-cdn.com/wp-content/uploads/2016/03/eagle-rising-logo3-1.png,http://2lv0hm3wvpix464wwy2zh7d1.wpengine.netdna-cdn.com/wp-content/uploads/wordpress-popular-posts/46729-featured-300x130.jpg,http://2lv0hm3wvpix464wwy2zh7d1.wpengine.netdna-cdn.com/wp-content/uploads/wordpress-popular-posts/46764-featured-300x130.jpg,http://2lv0hm3wvpix464wwy2zh7d1.wpengine.netdna-cdn.com/wp-content/uploads/wordpress-popular-posts/46731-featured-300x130.jpg,http://pixel.quantserve.com/pixel/p-52ePUfP6_NxQ_.gif,http://2.gravatar.com/avatar/27fc98a9182e3045ce89c59af3a420c4?s=100&d=mm&r=g,http://2lv0hm3wvpix464wwy2zh7d1.wpengine.netdna-cdn.com/wp-content/uploads/2017/04/crtv_300x250_2.jpg,http://b.scorecardresearch.com/p?c1=2&c2=22315475&cv=2.0&cj=1,http://eaglerising.com/wp-content/uploads/2016/09/trump-2.jpg,http://2lv0hm3wvpix464wwy2zh7d1.wpengine.netdna-cdn.com/wp-content/uploads/wordpress-popular-posts/46784-featured-300x130.png,http://2lv0hm3wvpix464wwy2zh7d1.wpengine.netdna-cdn.com/wp-content/uploads/wordpress-popular-posts/46774-featured-300x130.jpg,http://2lv0hm3wvpix464wwy2zh7d1.wpengine.netdna-cdn.com/wp-content/uploads/wordpress-popular-posts/46750-featured-300x130.jpg,http://2lv0hm3wvpix464wwy2zh7d1.wpengine.netdna-cdn.com/wp-content/uploads/2016/09/trump-2-800x300.jpg,http://2lv0hm3wvpix464wwy2zh7d1.wpengine.netdna-cdn.com/wp-content/uploads/wordpress-popular-posts/46763-featured-300x130.jpg,http://2lv0hm3wvpix464wwy2zh7d1.wpengine.netdna-cdn.com/wp-content/uploads/2016/09/death-tax-375x195.jpg,http://2lv0hm3wvpix464wwy2zh7d1.wpengine.netdna-cdn.com/wp-content/uploads/wordpress-popular-posts/46612-featured-300x130.jpg,http://2lv0hm3wvpix464wwy2zh7d1.wpengine.netdna-cdn.com/wp-content/uploads/wordpress-popular-posts/46761-featured-300x130.jpg,http://2lv0hm3wvpix464wwy2zh7d1.wpengine.netdna-cdn.com/wp-content/uploads/wordpress-popular-posts/46642-featured-300x130.jpg,http://2lv0hm3wvpix464wwy2zh7d1.wpengine.netdna-cdn.com/wp-content/uploads/wordpress-popular-posts/46735-featured-300x130.jpg,http://2lv0hm3wvpix464wwy2zh7d1.wpengine.netdna-cdn.com/wp-content/uploads/wordpress-popular-posts/46755-featured-300x130.jpg,http://2lv0hm3wvpix464wwy2zh7d1.wpengine.netdna-cdn.com/wp-content/uploads/wordpress-popular-posts/46752-featured-300x130.png,http://2lv0hm3wvpix464wwy2zh7d1.wpengine.netdna-cdn.com/wp-content/uploads/wordpress-popular-posts/46743-featured-300x130.jpg,http://2lv0hm3wvpix464wwy2zh7d1.wpengine.netdna-cdn.com/wp-content/uploads/wordpress-popular-posts/46712-featured-300x130.jpg,http://2.gravatar.com/avatar/27fc98a9182e3045ce89c59af3a420c4?s=112&d=mm&r=g,http://2lv0hm3wvpix464wwy2zh7d1.wpengine.netdna-cdn.com/wp-content/uploads/wordpress-popular-posts/46757-featured-300x130.png,http://2lv0hm3wvpix464wwy2zh7d1.wpengine.netdna-cdn.com/wp-content/uploads/2016/09/texas-375x195.jpg",http://eaglerising.com/36966/trump-how-can-we-lead-when-we-cant-even-control-our-own-cities-video/,"{""description"": ""\""There is no compassion in tolerating lawless conduct. Crime and violence is an attack on the poor and will never be accepted in a Trump administration.\"""", ""og"": {""site_name"": ""Eagle Rising"", ""description"": ""\""There is no compassion in tolerating lawless conduct. Crime and violence is an attack on the poor and will never be accepted in a Trump administration.\"""", ""title"": ""Trump: \u201cHow Can we LEAD When we Can\u2019t Even Control Our Own Cities?\u201d [VIDEO]"", ""locale"": ""en_US"", ""image"": ""http://eaglerising.com/wp-content/uploads/2016/09/trump-2.jpg"", ""updated_time"": ""2016-09-23T22:55:31+00:00"", ""url"": ""http://eaglerising.com/36966/trump-how-can-we-lead-when-we-cant-even-control-our-own-cities-video/"", ""type"": ""article""}, ""robots"": ""noimageindex"", ""fb"": {""app_id"": 256195528075351, ""pages"": 135665053303678}, ""article"": {""section"": ""2016 Election"", ""published_time"": ""2016-09-23T07:30:04+00:00"", ""modified_time"": ""2016-09-23T22:55:31+00:00""}, ""viewport"": ""initial-scale=1,maximum-scale=1,user-scalable=no"", ""googlebot"": ""noimageindex""}",-5,540,-0.009259259,20,582,0.033678726,2.4,571,0.003434202,6.4,570,0.011954921,0.042937986,0.012693461,0.021214181,,Avg,,457.5194805,447.7532468,449.5662338,460.6831169,(AVERAGE)
Real_29-Webpage,9 times Ted Cruz insulted Donald Trump before endorsing him,"""Donald, you’re a sniveling coward,"" Ted Cruz said in March. | Getty 9 times Ted Cruz insulted Donald Trump before endorsing him

Two months after he was booed off the stage at the Republican National Convention for snubbing his party’s presidential nominee, Sen. Ted Cruz endorsed Donald Trump on Friday.

That declaration to vote for him, though, comes after the Texas senator openly disparaged his primary opponent repeatedly — in part responding to Trump’s attacks on his wife and father.

Story Continued Below

1. Early on, Cruz speculated that Trump’s tax returns could show a mob connection

In February, Cruz offered his take on why Trump hadn’t released his tax returns in an interview on NBC’s “Meet the Press,” suggesting that they might show “Donald's business dealings with the mob, with the mafia.”

“The fact that Donald seems terrified to release his taxes suggests that there’s a bombshell there,” Cruz said. “It’s natural to wonder, ‘Well, what is it that he's hiding in his taxes?’”

2. In March, Cruz called him a “sniveling coward”

Speaking to a group of reporters in Dane, Wisconsin, after Trump made a comment promising to “spill the beans” on the senator’s wife, Cruz pointed his finger and said, “Donald, you’re a sniveling coward. Leave Heidi the hell alone.”

“It’s not easy to tick me off. I don’t get angry often, but you mess with my wife, you mess with my kids, that’ll do it every time,” Cruz said.

3. He also called Trump a “big, loud New York bully”

“Let me be absolutely clear: Our spouses and our children are off bounds,” Cruz said . “It is not acceptable for a big, loud New York bully to attack my wife.”

4. Also, “a small and petty man who is intimidated by strong women”

Trump’s attacks, Cruz suggested , were actions of “a small and petty man who is intimidated by strong women.”

5. Cruz called one of Trump’s theories “nuts” and “just kooky”

In May, after Trump cited a National Enquirer report that alleged Cruz’s father may have had some involvement in the assassination of President John F. Kennedy, Cruz addressed reporters in Evansville, Indiana: “This morning, Donald Trump went on national television and attacked my father. Donald Trump alleges that my dad was involved in assassinating JFK. Now, let’s be clear, this is nuts. This is not a reasonable position. This is just kooky.”

6. He also called him a “pathological liar” who “lies practically every word that comes out of his mouth”

Also in Indiana, on the same day the state's voters would deliver a decisive victory to Trump, Cruz added : “I’m gonna tell you what I really think of Donald Trump: This man is a pathological liar. He doesn’t know the difference between truth and lies. He lies practically every word that comes out of his mouth, and in a pattern that I think is straight out of a psychology textbook, his response is to accuse everybody else of lying.”

7. And Cruz was specific with the term “pathological”: Trump is “utterly amoral,” he said

“I say pathological because I actually think Donald, if you hooked him up to a lie detector test, he could say one thing in the morning, one thing at noon and one thing in the evening, all contradictory and he’d pass the lie detector test each time. Whatever lie he’s telling, at that minute he believes it, but the man is utterly amoral,” Cruz said .

8. And, while he was at it, Cruz accused him of narcissism and being a “serial philanderer”

Continuing to unload in Indiana, Cruz offered : “He combines [dishonesty] with being a narcissist, a narcissist at a level I don’t think this country’s ever seen. Donald Trump is such a narcissist that Barack Obama looks at him and says, ‘Dude, what’s your problem?’’’

And: “Donald Trump is a serial philanderer, and he boasts about it. This is not a secret. He’s proud of being a serial philanderer.”

9. In July, Cruz still hadn’t forgiven Trump for the attacks on his family

“I am not in the habit of supporting people who attack my wife and attack my father,” Cruz said, answering questions at a Texas delegation breakfast at the Republican National Convention in Cleveland and facing backlash for not yet endorsing Trump.

Referring to his pledge to support his party’s nominee, Cruz said that statement “was not a blanket commitment that if you slander and attack Heidi I'm going to nonetheless go like a servile puppy dog"" and support him.

Authors:",http://politi.co/2cSUHmo,http://static.politico.com/89/08/33b4aa9842b5af9d355e1ac415de/160923-ted-cruz-gty-1160.jpg,"Madeline Conway,Burgess Everett,Katie Glueck,Jack Shafer",http://politi.co,{'$date': 1474649129000},,"http://static.politico.com/89/08/33b4aa9842b5af9d355e1ac415de/160923-ted-cruz-gty-1160.jpg,https://static.politico.com/dims4/default/f7ded1e/2147483647/resize/1160x%3E/quality/90/?url=http%3A%2F%2Fstatic.politico.com%2F89%2F08%2F33b4aa9842b5af9d355e1ac415de%2F160923-ted-cruz-gty-1160.jpg,data:image/gif;base64,R0lGODlhAQABAAAAACH5BAEKAAEALAAAAAABAAEAAAICTAEAOw==",http://www.politico.com/story/2016/09/ted-cruz-donald-trump-insults-endorse-228594,"{""description"": ""The Texas senator's endorsement comes after he openly disparaged Donald Trump repeatedly."", ""og"": {""site_name"": ""POLITICO"", ""description"": ""The Texas senator's endorsement comes after he openly disparaged Donald Trump repeatedly."", ""title"": ""9 times Ted Cruz insulted Donald Trump before endorsing him"", ""url"": ""http://politi.co/2dgVZYf"", ""image"": ""http://static.politico.com/89/08/33b4aa9842b5af9d355e1ac415de/160923-ted-cruz-gty-1160.jpg"", ""fb_appid"": 114037015331397, ""type"": ""article""}, ""twitter"": {""site"": ""@politico"", ""card"": ""summary_large_image"", ""creator"": ""@politico""}, ""host"": ""www.politico.com"", ""fb"": {""pages"": 62317591679}, ""build"": ""release/2017-maria 4b1f874 2017-08-24T15:20:21Z"", ""article"": {""author"": ""https://www.facebook.com/politico/""}, ""viewport"": ""width=device-width, initial-scale=1""}",-40,974,-0.041067762,-4.4,906.2,-0.00486969,-10.6,972.4,-0.010513256,1.8,992.4,0.001568082,0.036198072,0.030554506,0.042635844,,Median,,419,428.6,437,436,(MEDIAN)
Real_3-Webpage,"Critical counties: Wake County, NC, could put up a fight","Critical Counties is a CNN series exploring 11 counties around the country that chief national correspondent John King has identified as key in the 2016 election. These counties could play an outsize role in the election and offer an instructive example of what the political parties have accomplished. Wake County is the fourth county in the series, which runs through Election Day. Explore the other critical counties.

Washington (CNN)

Few counties could prove more decisive in this election than Wake County, North Carolina.

A historically competitive county whose fortunes are on the rise, Wake could help deliver Hillary Clinton a win in a key battleground state -- or dash her hopes for the presidency. Simply put, if Clinton performs well in the highly educated research triangle, then election night bodes well for her. If Wake County doesn't come out for Clinton, Donald Trump's path to the White House would grow much clearer.

The county is rapidly expanding, and the influx of new people and industries could reshape the race. Meanwhile, the turmoil across the state in Charlotte after a police officer shot and killed a black man could add another focal point in the election — search data from Google Trends shows Wake County's spiking interest in ""police brutality"" this week.

Keep your eye on Wake County, and take a look at the fundamentals below.

Population

Wake County is fairly representative of the country in terms of race and ethnicity, but it has a more highly educated population, bigger incomes and a better job picture than the rest of the nation.

Read More",http://cnn.it/2dnoYpa,http://i2.cdn.cnn.com/cnnnext/dam/assets/160919111340-critical-counties-wake-2016-origwx-js-00000227-super-tease.jpg,"Joyce Tseng,Eli Watkins",http://cnn.it,,,"http://i2.cdn.cnn.com/cnnnext/dam/assets/160919111340-critical-counties-wake-2016-origwx-js-00000227-super-tease.jpg,http://i2.cdn.cnn.com/cnnnext/dam/assets/160919111340-critical-counties-wake-2016-origwx-js-00000227-exlarge-169.jpg,http://i2.cdn.turner.com/cnn/2016/images/09/26/03repsdemocrat-icon.png,http://i2.cdn.turner.com/cnn/2016/images/09/26/03repsrepublican-icon.png",http://www.cnn.com/2016/09/23/politics/critical-counties-wake-north-carolina-raleigh/index.html,"{""pubdate"": ""2016-09-23T16:55:31Z"", ""author"": ""Joyce Tseng and Eli Watkins, CNN"", ""og"": {""site_name"": ""CNN"", ""pubdate"": ""2016-09-23T16:55:31Z"", ""title"": ""Critical counties: Wake County, NC, could put up a fight"", ""url"": ""http://www.cnn.com/2016/09/23/politics/critical-counties-wake-north-carolina-raleigh/index.html"", ""image"": {""width"": 1100, ""identifier"": ""http://i2.cdn.cnn.com/cnnnext/dam/assets/160919111340-critical-counties-wake-2016-origwx-js-00000227-super-tease.jpg"", ""height"": 619}, ""type"": ""article""}, ""section"": ""politics"", ""fb"": {""app_id"": 80401312489, ""pages"": ""5550296508,18793419640""}, ""thumbnail"": ""http://i2.cdn.cnn.com/cnnnext/dam/assets/160919111340-critical-counties-wake-2016-origwx-js-00000227-super-tease.jpg"", ""template-top"": ""politics,bra-app-destination-hub,art-vid"", ""vr"": {""canonical"": ""http://www.cnn.com/2016/09/23/politics/critical-counties-wake-north-carolina-raleigh/index.html""}, ""keywords"": ""politics, Critical counties: Wake County, NC, could put up a fight - CNNPolitics"", ""lastmod"": ""2016-09-23T16:55:31Z"", ""twitter"": {""image"": ""http://i2.cdn.cnn.com/cnnnext/dam/assets/160919111340-critical-counties-wake-2016-origwx-js-00000227-super-tease.jpg"", ""card"": ""summary_large_image"", ""title"": ""Critical counties: Wake County, NC, could put up a fight""}, ""viewport"": ""width=device-width, initial-scale=1.0, minimum-scale=1.0""}",14,293,0.04778157,16.2,285.6,0.057733392,15.8,293.6,0.05382984,15.8,288.2,0.055551242,0.009951822,0.00604827,0.007769672,,STDEV,,233.6395609,211.0735525,211.7073388,224.2067352,(STDEV.P)
Real_30-Webpage,"Obama wears hat, breaking ‘Politics 101’ rule on headgear","Obama wears hat, breaking ‘Politics 101’ rule on headgear

President Barack Obama violated the longstanding, albeit unofficial, rule against presidential headgear on Monday when he accepted a hat and blanket at the White House Tribal Nations Conference.

The president was given the hat and blanket by Native American leaders as he took the stage ahead of remarks at the conference. He wore the blanket around his shoulders as a song was played in his honor, but took the hat off after just a few moments.

Story Continued Below

“What an amazing honor and what a kind gesture, for the honor song and the blanket and the hat,” Obama said once he took the podium. “I have to say that I am very glad that you also have a blanket for Michelle so she doesn’t steal mine. She would, too. I’m just saying.”

“That was very moving, and is a reminder of the great friendships that we’ve developed over the last eight years,” he added.

The unofficial rule against presidents wearing unusual hats is widely credited to Democratic presidential nominee Michael Dukakis, whose decision to wear a tank-commander’s helmet during a ride in an M1A1 Abrams Main Battle Tank has been widely ridiculed to this day.

Obama himself acknowledged the rule during a 2013 visit from the Naval Academy’s football team, which presented him with one of its helmets.

“Here’s the general rule: You don’t put stuff on your head if you’re president,” Obama said, explaining his refusal to put on the helmet that had been fitted for him. “That’s Politics 101. You never look good wearing something on your head.”

Authors:",http://politi.co/2dbESny,http://v.politico.com/images/1155968404/201609/1540/1155968404_5142194641001_5142158442001-vs.jpg?pubId=1155968404,"Jack Shafer,Louis Nelson",http://politi.co,{'$date': 1474908937000},,"http://v.politico.com/images/1155968404/201609/1540/1155968404_5142194641001_5142158442001-vs.jpg?pubId=1155968404,data:image/gif;base64,R0lGODlhAQABAAAAACH5BAEKAAEALAAAAAABAAEAAAICTAEAOw==",http://www.politico.com/story/2016/09/barack-obama-wears-hat-president-228693,"{""description"": ""The president was given the hat and blanket by Native American leaders."", ""og"": {""site_name"": ""POLITICO"", ""description"": ""The president was given the hat and blanket by Native American leaders."", ""title"": ""Obama wears hat, breaking \u2018Politics 101\u2019 rule on headgear"", ""url"": ""http://politi.co/2cx9P2y"", ""image"": ""http://v.politico.com/images/1155968404/201609/1540/1155968404_5142194641001_5142158442001-vs.jpg?pubId=1155968404"", ""fb_appid"": 114037015331397, ""type"": ""article""}, ""twitter"": {""site"": ""@politico"", ""card"": ""summary_large_image"", ""creator"": ""@politico""}, ""host"": ""www.politico.com"", ""fb"": {""pages"": 62317591679}, ""build"": ""release/2017-maria 4b1f874 2017-08-24T15:20:21Z"", ""article"": {""author"": ""https://www.facebook.com/politico/""}, ""viewport"": ""width=device-width, initial-scale=1""}",17,327,0.051987768,16.8,305.2,0.054826579,21.8,321.2,0.067910074,24.8,321.8,0.076874403,0.002838812,0.015922306,0.024886636,,Min,,140,135.2,139.4,141.2,(MIN)
Real_31-Webpage,Clinton: ‘The next 50 days will determine the next 50 years’,"Hillary Clinton said this year's election will impact the next 50 years of America. | AP Photo Clinton: ‘The next 50 days will determine the next 50 years’

Hillary Clinton on Tuesday warned that the nearly 50-day sprint to Election Day will impact far more than just the next four or eight years.

Making an appeal to black voters during an interview on the “Steve Harvey Morning Show,” Clinton stressed that voters can’t sit this one out.

Story Continued Below

“Every issue they care about is at stake in this election,” Clinton said. “This is not: ‘Oh, you know, a little here, a little there. We can — you know, we can take it, no matter who wins.’ No. The next 50 days will determine the next 50 years, and I say that absolutely seriously.”

The former secretary of state said she hopes everyone is registered to vote and directed listeners to a website to find out whether they’re registered “because I need you.”

“We gotta stand up and be counted in this election,” she added.

Clinton’s comments come after President Barack Obama made an appeal on Clinton's and his own behalf in an address to the Congressional Black Caucus Foundation on Saturday.

“My name may not be on the ballot, but our progress is on the ballot,” Obama said. “Tolerance is on the ballot. Democracy is on the ballot. Justice is on the ballot. Good schools are on the ballot. Ending mass incarceration, that’s on the ballot right now.”

But up next on the docket is the first presidential debate between Clinton and Trump on Monday in New York, where the former senator expects to absorb a bunch of body blows from an aggressive foe.

“I am going to do my very best to communicate as clearly and fearlessly as I can in the face of the insults and the attacks and the bullying and bigotry that we’ve seen coming from my opponent,” she said. “You know, I can take it, Steve. I can take that kind of stuff. I’ve been at this and, you know, I understand it’s a contact sport.”

What Clinton won’t take, though, is any insults toward anyone else. “You know, his attacks on African-Americans and immigrants and Muslims and women and people with disabilities, it’s just — it’s just something we cannot tolerate,” she said.

As Clinton wrapped up her interview, Trump taunted her on Twitter: “Hillary Clinton is taking the day off again, she needs the rest. Sleep well Hillary — see you at the debate!”

Authors:",http://politi.co/2cmo9Qd,http://static.politico.com/49/14/53e2365742a1b9469034f59209de/08-hillary-clinton-1-ap-1160.jpg,"Jack Shafer,Nolan D",http://politi.co,{'$date': 1474367623000},,"https://static.politico.com/dims4/default/4cbc8c6/2147483647/resize/1160x%3E/quality/90/?url=http%3A%2F%2Fstatic.politico.com%2F49%2F14%2F53e2365742a1b9469034f59209de%2F08-hillary-clinton-1-ap-1160.jpg,data:image/gif;base64,R0lGODlhAQABAAAAACH5BAEKAAEALAAAAAABAAEAAAICTAEAOw==,http://static.politico.com/49/14/53e2365742a1b9469034f59209de/08-hillary-clinton-1-ap-1160.jpg",http://www.politico.com/story/2016/09/clinton-whats-at-stake-in-2016-election-228404,"{""description"": ""\u201cWe gotta stand up and be counted in this election,\u201d she added."", ""og"": {""site_name"": ""POLITICO"", ""description"": ""\u201cWe gotta stand up and be counted in this election,\u201d she added."", ""title"": ""Clinton: \u2018The next 50 days will determine the next 50 years\u2019"", ""url"": ""http://politi.co/2d1Uwok"", ""image"": ""http://static.politico.com/49/14/53e2365742a1b9469034f59209de/08-hillary-clinton-1-ap-1160.jpg"", ""fb_appid"": 114037015331397, ""type"": ""article""}, ""twitter"": {""site"": ""@politico"", ""card"": ""summary_large_image"", ""creator"": ""@politico""}, ""host"": ""www.politico.com"", ""fb"": {""pages"": 62317591679}, ""build"": ""release/2017-maria 4b1f874 2017-08-24T15:20:21Z"", ""article"": {""author"": ""https://www.facebook.com/NolanDMcCaskill""}, ""viewport"": ""width=device-width, initial-scale=1""}",7,524,0.013358779,7.6,549.4,0.0134521,7.4,557.4,0.013349523,14.6,565.4,0.025439683,9.33E-05,9.26E-06,0.012080904,,Max,,1178,978.2,1003.4,992.4,(MAX)
